"N-gram","原文","翻译","Total"
"为慈母的族亲服丧","0","2","2"
"之子不为慈母服丧","0","2","2"
"对任师保的那种慈","0","2","2"
"收聚学生讲授经学","0","2","2"
"的学生常常达到数","0","2","2"
"学生常常达到数百","0","2","2"
"生常常达到数百人","0","2","2"
"被除授为员外散骑","0","2","2"
"除授为员外散骑侍","0","2","2"
"中书舍人贺琛奉皇","0","2","2"
"书舍人贺琛奉皇上","0","2","2"
"父亲去世而离职守","0","2","2"
"母亲去世而离职守","0","2","2"
"讨伐东昏侯的义军","0","2","2"
"东昏侯的义军平定","0","2","2"
"特别精通佛教的经","0","2","2"
"别精通佛教的经典","0","2","2"
"夏后氏祭送死人用","0","2","2"
"后氏祭送死人用明","0","2","2"
"氏祭送死人用明器","0","2","2"
"这是明白地告诉百","0","2","2"
"是明白地告诉百姓","0","2","2"
"殷人祭送死人用祭","0","2","2"
"人祭送死人用祭器","0","2","2"
"拜授他为太中大夫","0","2","2"
"后来何远又被起用","0","2","2"
"来何远又被起用为","0","2","2"
"使者前来进献贡品","0","2","2"
"击败林邑国的军队","0","2","2"
"林邑王又派遣使者","0","2","2"
"又派遣使者进献当","0","2","2"
"高祖下诏命他为持","0","2","2"
"祖下诏命他为持节","0","2","2"
"王又派遣使者献纳","0","2","2"
"又派遣使者献纳当","0","2","2"
"邪跋摩又派遣使者","0","2","2"
"跋摩又派遣使者呈","0","2","2"
"摩又派遣使者呈送","0","2","2"
"跋摩多次派遣使者","0","2","2"
"多次派遣使者进献","0","2","2"
"我们怀着至诚之心","0","2","2"
"大将军百济王余隆","0","2","2"
"岁就送出狱去做奴","0","2","2"
"呈奉表章进献贡品","0","2","2"
"妻子并肩而坐接待","0","2","2"
"子并肩而坐接待宾","0","2","2"
"并肩而坐接待宾客","0","2","2"
"国派遣使者进献当","0","2","2"
"后朝廷征召他为侍","0","2","2"
"朝廷征召他为侍中","0","2","2"
"不能东进占有函谷","0","2","2"
"荆州刺史湘东王萧","0","2","2"
"州刺史湘东王萧绎","0","2","2"
"南兖州刺史南康嗣","0","2","2"
"兖州刺史南康嗣王","0","2","2"
"州刺史南康嗣王萧","0","2","2"
"刺史南康嗣王萧会","0","2","2"
"史南康嗣王萧会理","0","2","2"
"任命行宕昌王梁弥","0","2","2"
"夏侯详为右光禄大","0","2","2"
"侯详为右光禄大夫","0","2","2"
"光禄大夫夏侯详为","0","2","2"
"刺史安成王萧秀为","0","2","2"
"郢州刺史鄱阳王萧","0","2","2"
"任命南徐州刺史豫","0","2","2"
"命南徐州刺史豫章","0","2","2"
"徐州刺史豫章王萧","0","2","2"
"刺史豫章王萧综为","0","2","2"
"将军南康王萧绩为","0","2","2"
"任命太子詹事萧渊","0","2","2"
"命太子詹事萧渊藻","0","2","2"
"太子詹事萧渊藻为","0","2","2"
"宣城王大器为中军","0","2","2"
