"N-gram","原文","翻译","Total"
"后来何远又被起用为","0","2","2"
"又派遣使者进献当地","0","2","2"
"多次派遣使者献纳贡","0","2","2"
"高祖下诏命他为持节","0","2","2"
"又派遣使者献纳当地","0","2","2"
"跋摩又派遣使者呈送","0","2","2"
"妻子并肩而坐接待宾","0","2","2"
"子并肩而坐接待宾客","0","2","2"
"国派遣使者进献当地","0","2","2"
"后朝廷征召他为侍中","0","2","2"
"荆州刺史湘东王萧绎","0","2","2"
"南兖州刺史南康嗣王","0","2","2"
"兖州刺史南康嗣王萧","0","2","2"
"州刺史南康嗣王萧会","0","2","2"
"刺史南康嗣王萧会理","0","2","2"
"夏侯详为右光禄大夫","0","2","2"
"州刺史安成王萧秀为","0","2","2"
"郢州刺史鄱阳王萧恢","0","2","2"
"任命南徐州刺史豫章","0","2","2"
"命南徐州刺史豫章王","0","2","2"
"南徐州刺史豫章王萧","0","2","2"
"徐州刺史豫章王萧综","0","2","2"
"州刺史豫章王萧综为","0","2","2"
"任命太子詹事萧渊藻","0","2","2"
"命太子詹事萧渊藻为","0","2","2"
