"N-gram","原文","翻译","Total"
"水又在右边汇合了","0","2","2"
"黄卢山水发源于西","0","2","2"
"卢山水发源于西北","0","2","2"
"山水发源于西北天","0","2","2"
"水发源于西北天水","0","2","2"
"发源于西北天水郡","0","2","2"
"源于西北天水郡黄","0","2","2"
"于西北天水郡黄卢","0","2","2"
"北天水郡黄卢山中","0","2","2"
"然后往东北注入白","0","2","2"
"后往东北注入白水","0","2","2"
"流经南阳侨郡东北","0","2","2"
"又往东南流经新巴","0","2","2"
"往东南流经新巴县","0","2","2"
"东南流经新巴县东","0","2","2"
"南流经新巴县东北","0","2","2"
"水又往东南流经一","0","2","2"
"溪水发源于南面的","0","2","2"
"汝水又往东北流向","0","2","2"
"水又往东北流向狼","0","2","2"
"又往东北流向狼皋","0","2","2"
"往东北流向狼皋山","0","2","2"
"水发源于北方的梁","0","2","2"
"南流经该县老城西","0","2","2"
"流经该县老城西面","0","2","2"
"水发源于北面的山","0","2","2"
"发源于北面的山陵","0","2","2"
"水发源于鲁阳县的","0","2","2"
"百沟水发源于夏亭","0","2","2"
"沟水发源于夏亭城","0","2","2"
"水发源于夏亭城西","0","2","2"
"发源于夏亭城西面","0","2","2"
"又往南流经龙城西","0","2","2"
"往南流经龙城西面","0","2","2"
"孝惠帝后宫所生的","0","2","2"
"惠帝后宫所生的儿","0","2","2"
"帝后宫所生的儿子","0","2","2"
"湛水又往东南流经","0","2","2"
"水又往东南流经蒲","0","2","2"
"又往东流经定陵城","0","2","2"
"往东流经定陵城南","0","2","2"
"因为九江有个下蔡","0","2","2"
"安帝将这地方封给","0","2","2"
"帝将这地方封给皇","0","2","2"
"将这地方封给皇后","0","2","2"
"这地方封给皇后之","0","2","2"
"地方封给皇后之父","0","2","2"
"方封给皇后之父侍","0","2","2"
"封给皇后之父侍中","0","2","2"
"给皇后之父侍中阎","0","2","2"
"皇后之父侍中阎畅","0","2","2"
"水又往东南流经平","0","2","2"
"水又往东南流经新","0","2","2"
"往东南流经新蔡县","0","2","2"
"东南流经新蔡县老","0","2","2"
"南流经新蔡县老城","0","2","2"
"水又往东流经新息","0","2","2"
"汉水又往东流经长","0","2","2"
"又往东流经魏兴郡","0","2","2"
"阴沟水又往东南流","0","2","2"
"水又往东南流经封","0","2","2"
"又往东南流经封丘","0","2","2"
"往东南流经封丘县","0","2","2"
"到大梁与菠蔼渠汇","0","2","2"
"大梁与菠蔼渠汇合","0","2","2"
"也都有鸿沟和沙水","0","2","2"
"都有鸿沟和沙水的","0","2","2"
"有鸿沟和沙水的名","0","2","2"
"鸿沟和沙水的名称","0","2","2"
"不知是什么时候建","0","2","2"
"薄城城北以东三里","0","2","2"
"就是中书刘澄之所","0","2","2"
"这条水发源于白石","0","2","2"
"条水发源于白石山","0","2","2"
"往西流经李鹊城南","0","2","2"
"又往东南流经张祖","0","2","2"
"往东南流经张祖禧","0","2","2"
"东南流经张祖禧城","0","2","2"
"南流经张祖禧城南","0","2","2"
"就是宣城郡的石城","0","2","2"
"是宣城郡的石城县","0","2","2"
"又往北流注入南江","0","2","2"
"以句余山名为县名","0","2","2"
"水又往东南流经安","0","2","2"
"比水发源于比阳县","0","2","2"
"泄水从南方流来注","0","2","2"
"水从南方流来注入","0","2","2"
"水又往西南流经长","0","2","2"
"台阶都用青石砌成","0","2","2"
"一条发源于少室山","0","2","2"
"条发源于少室山的","0","2","2"
"流与右边那条水汇","0","2","2"
"与右边那条水汇合","0","2","2"
"把这地方封给邓晨","0","2","2"
"新阳县在新水之阳","0","2","2"
"支流又往东北流经","0","2","2"
"又往东流经女阴县","0","2","2"
"往东流经女阴县旧","0","2","2"
"东流经女阴县旧城","0","2","2"
"史记•高祖功臣侯","0","2","2"
"记•高祖功臣侯者","0","2","2"
"•高祖功臣侯者年","0","2","2"
"洧水又往东南流经","0","2","2"
"洧水又往东流经新","0","2","2"
"龙在时门外的洧渊","0","2","2"
"在时门外的洧渊相","0","2","2"
"时门外的洧渊相斗","0","2","2"
"黄水又往东南流经","0","2","2"
"龙渊水又往东流经","0","2","2"
"渊水又往东流经长","0","2","2"
"水又往东流经长社","0","2","2"
"又往东流经长社县","0","2","2"
"往东流经长社县旧","0","2","2"
"东流经长社县旧城","0","2","2"
"流经长社县旧城北","0","2","2"
"经长社县旧城北边","0","2","2"
"这里原是郑国的长","0","2","2"
"里原是郑国的长葛","0","2","2"
"原是郑国的长葛邑","0","2","2"
"另一条往东流经许","0","2","2"
"一条往东流经许昌","0","2","2"
"条往东流经许昌县","0","2","2"
"甲庚沟从东北导入","0","2","2"
"庚沟从东北导入沙","0","2","2"
"沟从东北导入沙水","0","2","2"
"也许就是杜氏所说","0","2","2"
"许就是杜氏所说的","0","2","2"
"就是杜氏所说的辰","0","2","2"
"是杜氏所说的辰亭","0","2","2"
"杜氏所说的辰亭了","0","2","2"
"水又南流分为两条","0","2","2"
"水又往东流经长平","0","2","2"
"洧水往东南流到长","0","2","2"
"水往东南流到长平","0","2","2"
"往东南流到长平县","0","2","2"
"东南流到长平县注","0","2","2"
"南流到长平县注入","0","2","2"
"流到长平县注入颖","0","2","2"
"到长平县注入颖水","0","2","2"
"此水又南流注入淆","0","2","2"
"水又南流注入淆水","0","2","2"
"梁惠成王十六年前","0","2","2"
"往东北流经中牟县","0","2","2"
"往东南流经开封县","0","2","2"
"在逢泽与诸侯相会","0","2","2"
"康沟水又往东流经","0","2","2"
"地名在七乡十二亭","0","2","2"
"名在七乡十二亭之","0","2","2"
"在七乡十二亭之列","0","2","2"
"沙水又往东南流经","0","2","2"
"水又往东南流经东","0","2","2"
"又往东南注入颖水","0","2","2"
"水旁有一条大堤堰","0","2","2"
"就是古时的百尺堰","0","2","2"
"把这地方封给垂相","0","2","2"
"这地方封给垂相魏","0","2","2"
"地方封给垂相魏相","0","2","2"
"把这地方封给鲁恭","0","2","2"
"这地方封给鲁恭王","0","2","2"
"十五年把这地方封","0","2","2"
"五年把这地方封给","0","2","2"
"元年把这地方封给","0","2","2"
"王莽时改名为力聚","0","2","2"
"因曹操父亲曾在此","0","2","2"
"曹操父亲曾在此避","0","2","2"
"操父亲曾在此避难","0","2","2"
"父亲曾在此避难被","0","2","2"
"亲曾在此避难被害","0","2","2"
"他就屠杀了男女十","0","2","2"
"就屠杀了男女十万","0","2","2"
"屠杀了男女十万余","0","2","2"
"杀了男女十万余人","0","2","2"
"了男女十万余人泄","0","2","2"
"男女十万余人泄愤","0","2","2"
"泗水因此堵塞不流","0","2","2"
"这也太残暴了泗水","0","2","2"
"也太残暴了泗水又","0","2","2"
"太残暴了泗水又往","0","2","2"
"残暴了泗水又往东","0","2","2"
"暴了泗水又往东南","0","2","2"
"了泗水又往东南流","0","2","2"
"泗水又往东南流到","0","2","2"
"水又往东南流到睢","0","2","2"
"又往东南流到睢水","0","2","2"
"往东南流到睢水口","0","2","2"
"水发源于北面的桑","0","2","2"
"发源于北面的桑预","0","2","2"
"源于北面的桑预山","0","2","2"
"水发源于北方的五","0","2","2"
"把这里封给城阳共","0","2","2"
"这里封给城阳共王","0","2","2"
"里封给城阳共王的","0","2","2"
"封给城阳共王的儿","0","2","2"
"给城阳共王的儿子","0","2","2"
"城阳共王的儿子刘","0","2","2"
"蒙山水发源于蒙山","0","2","2"
"山水发源于蒙山的","0","2","2"
"水发源于蒙山的北","0","2","2"
"发源于蒙山的北面","0","2","2"
"往东流经阳都县南","0","2","2"
"东流经阳都县南面","0","2","2"
"治水又往东南流经","0","2","2"
"水又往东北流经上","0","2","2"
"汉水又往东流经郧","0","2","2"
"水又往东流经郧乡","0","2","2"
"又往东流经郧乡县","0","2","2"
"间口头相传造成的","0","2","2"
"沔水又往东南流经","0","2","2"
"洛阳城北面紧靠洛","0","2","2"
"阳城北面紧靠洛溪","0","2","2"
"关羽把于禁围困在","0","2","2"
"羽把于禁围困在此","0","2","2"
"把于禁围困在此城","0","2","2"
"当时正逢沔水泛滥","0","2","2"
"时正逢沔水泛滥外","0","2","2"
"正逢沔水泛滥外溢","0","2","2"
"乘船至东冈不屈而","0","2","2"
"船至东冈不屈而死","0","2","2"
"在右面汇合了一条","0","2","2"
"右面汇合了一条支","0","2","2"
"面汇合了一条支流","0","2","2"
"这条支流发源于大","0","2","2"
"条支流发源于大洪","0","2","2"
"支流发源于大洪山","0","2","2"
"往西南流经襄阳都","0","2","2"
"西南流经襄阳都县","0","2","2"
"南流经襄阳都县边","0","2","2"
"流经襄阳都县边界","0","2","2"
"往西南流经狄城东","0","2","2"
"西南流经狄城东南","0","2","2"
"水发源于竟陵县东","0","2","2"
"荒谷东岸有座冶父","0","2","2"
"谷东岸有座冶父城","0","2","2"
"诸将帅被囚禁在冶","0","2","2"
"将帅被囚禁在冶父","0","2","2"
"湖水又往东注入扬","0","2","2"
"水又往东注入扬水","0","2","2"
"所以取名为云杜县","0","2","2"
"难道昭王的尸体会","0","2","2"
"道昭王的尸体会逆","0","2","2"
"昭王的尸体会逆流","0","2","2"
"王的尸体会逆流而","0","2","2"
"的尸体会逆流而上","0","2","2"
"尸体会逆流而上吗","0","2","2"
"南北十五里内的田","0","2","2"
"北十五里内的田地","0","2","2"
"封给齐孝王的儿子","0","2","2"
"说的都是同一条水","0","2","2"
"耿弃在临淄打败了","0","2","2"
"弃在临淄打败了张","0","2","2"
"在临淄打败了张步","0","2","2"
"水上的浮尸连成一","0","2","2"
"上的浮尸连成一片","0","2","2"
"启有个儿子叫五观","0","2","2"
"他所居的城邑你观","0","2","2"
"事实如何不大清楚","0","2","2"
"此口的水发源于南","0","2","2"
"口的水发源于南郊","0","2","2"
"的水发源于南郊山","0","2","2"
"水发源于南郊山下","0","2","2"
"水从县城左前方流","0","2","2"
"从县城左前方流出","0","2","2"
"往东北流经东安平","0","2","2"
"齐悼惠王的儿子刘","0","2","2"
"汶水又往东北流经","0","2","2"
"溉载秦始皇的功德","0","2","2"
"流经平昌县旧城东","0","2","2"
"经平昌县旧城东边","0","2","2"
"往东北流经平昌县","0","2","2"
"东北流经平昌县旧","0","2","2"
"汉文帝把这里封给","0","2","2"
"水又往东北流经高","0","2","2"
"又往东北流经高密","0","2","2"
"往东北流经高密县","0","2","2"
"东北流经高密县旧","0","2","2"
"北流经高密县旧城","0","2","2"
"流经高密县旧城南","0","2","2"
"睢水又往东南流经","0","2","2"
"水又往东南流经竹","0","2","2"
"秦始皇二十三年前","0","2","2"
"西边到彭城街丘县","0","2","2"
"边到彭城街丘县旧","0","2","2"
"到彭城街丘县旧城","0","2","2"
"彭城街丘县旧城东","0","2","2"
"城街丘县旧城东边","0","2","2"
"这就是王莽时的符","0","2","2"
"就是王莽时的符合","0","2","2"
"水发源于县城西南","0","2","2"
"淮水支流又往东流","0","2","2"
"陵南一里处有尧母","0","2","2"
"南一里处有尧母庆","0","2","2"
"一里处有尧母庆都","0","2","2"
"里处有尧母庆都陵","0","2","2"
"在成阳城的西南方","0","2","2"
"石庙在成阳城西南","0","2","2"
"旧河道又往北流经","0","2","2"
"河道又往北流经东","0","2","2"
"道又往北流经东阿","0","2","2"
"又往北流经东阿县","0","2","2"
"往北流经东阿县旧","0","2","2"
"北流经东阿县旧城","0","2","2"
"流经东阿县旧城东","0","2","2"
"经东阿县旧城东边","0","2","2"
"然后东流注入祝阿","0","2","2"
"后东流注入祝阿县","0","2","2"
"盖野沟水源出延乡","0","2","2"
"野沟水源出延乡城","0","2","2"
"沟水源出延乡城东","0","2","2"
"水源出延乡城东北","0","2","2"
"往西北流经延乡城","0","2","2"
"西北流经延乡城北","0","2","2"
"北流经延乡城北边","0","2","2"
"定公十年来泰山筑","0","2","2"
"公十年来泰山筑坛","0","2","2"
"十年来泰山筑坛祭","0","2","2"
"年来泰山筑坛祭天","0","2","2"
"坐于东北边山麓的","0","2","2"
"于东北边山麓的明","0","2","2"
"东北边山麓的明堂","0","2","2"
"北边山麓的明堂中","0","2","2"
"汶水又往西南流经","0","2","2"
"现在是刚县的治所","0","2","2"
"往西南流经致密城","0","2","2"
"西南流经致密城北","0","2","2"
"南流经致密城北面","0","2","2"
"封城阳共王的儿子","0","2","2"
"往西流经无盐县旧","0","2","2"
"西流经无盐县旧城","0","2","2"
"墓碑和墓网都还在","0","2","2"
"淮渠流经桃城以南","0","2","2"
"这就是王莽所谓的","0","2","2"
"就是王莽所谓的瑞","0","2","2"
"是王莽所谓的瑞狐","0","2","2"
"在济北卢县老城西","0","2","2"
"济北卢县老城西南","0","2","2"
"往北流经卢县老城","0","2","2"
"丑父与顷公交换位","0","2","2"
"父与顷公交换位置","0","2","2"
"驾车的马被树绊住","0","2","2"
"汉武帝把这地方封","0","2","2"
"帝把这地方封给城","0","2","2"
"把这地方封给城阳","0","2","2"
"这地方封给城阳顷","0","2","2"
"地方封给城阳顷王","0","2","2"
"方封给城阳顷王的","0","2","2"
"封给城阳顷王的儿","0","2","2"
"给城阳顷王的儿子","0","2","2"
"城阳顷王的儿子刘","0","2","2"
"把这地方封给齐悼","0","2","2"
"这地方封给齐悼惠","0","2","2"
"地方封给齐悼惠王","0","2","2"
"方封给齐悼惠王的","0","2","2"
"般水发源于般阳县","0","2","2"
"水发源于般阳县东","0","2","2"
"发源于般阳县东南","0","2","2"
"源于般阳县东南的","0","2","2"
"于般阳县东南的龙","0","2","2"
"般阳县东南的龙山","0","2","2"
"就是王莽的济南亭","0","2","2"
"鱼子沟水发源于南","0","2","2"
"子沟水发源于南方","0","2","2"
"沟水发源于南方长","0","2","2"
"水发源于南方长白","0","2","2"
"发源于南方长白山","0","2","2"
"源于南方长白山东","0","2","2"
"于南方长白山东麓","0","2","2"
"南方长白山东麓的","0","2","2"
"方长白山东麓的柳","0","2","2"
"长白山东麓的柳泉","0","2","2"
"白山东麓的柳泉口","0","2","2"
"水又往东北流经乐","0","2","2"
"菏水又往东南流经","0","2","2"
"水又往东南流经乘","0","2","2"
"又往东南流经乘氏","0","2","2"
"往东南流经乘氏县","0","2","2"
"东南流经乘氏县老","0","2","2"
"南流经乘氏县老城","0","2","2"
"流经乘氏县老城南","0","2","2"
"经乘氏县老城南面","0","2","2"
"济水又往南流经彭","0","2","2"
"水又往南流经彭城","0","2","2"
"又往南流经彭城县","0","2","2"
"往南流经彭城县老","0","2","2"
"南流经彭城县老城","0","2","2"
"流经彭城县老城东","0","2","2"
"夜间忽然进来两个","0","2","2"
"间忽然进来两个孩","0","2","2"
"忽然进来两个孩子","0","2","2"
"管滓王派我们俩来","0","2","2"
"滓王派我们俩来拜","0","2","2"
"王派我们俩来拜见","0","2","2"
"派我们俩来拜见赵","0","2","2"
"我们俩来拜见赵皇","0","2","2"
"们俩来拜见赵皇帝","0","2","2"
"又高又平的土地叫","0","2","2"
"高又平的土地叫太","0","2","2"
"又平的土地叫太原","0","2","2"
"侯甲水又往西北流","0","2","2"
"西边离介山十五里","0","2","2"
"在龙门称颂大禹劳","0","2","2"
"龙门称颂大禹劳苦","0","2","2"
"门称颂大禹劳苦功","0","2","2"
"称颂大禹劳苦功高","0","2","2"
"有一块石头竟说起","0","2","2"
"一块石头竟说起话","0","2","2"
"块石头竟说起话来","0","2","2"
"汉朝末年天下大乱","0","2","2"
"南溪水发源于南山","0","2","2"
"水又往东南流经邓","0","2","2"
"流经长子县老城南","0","2","2"
"经长子县老城南面","0","2","2"
"往东流经屯留县老","0","2","2"
"东流经屯留县老城","0","2","2"
"专池水发源于八特","0","2","2"
"池水发源于八特山","0","2","2"
"又往东流经老城北","0","2","2"
"往东流经老城北面","0","2","2"
"水又往东流经武城","0","2","2"
"有房屋一百零一间","0","2","2"
"衡漳又往东北流经","0","2","2"
"往东流经蒲领县老","0","2","2"
"东流经蒲领县老城","0","2","2"
"流经蒲领县老城南","0","2","2"
"经蒲领县老城南面","0","2","2"
"又流经南皮县的北","0","2","2"
"流经南皮县的北皮","0","2","2"
"经南皮县的北皮亭","0","2","2"
"然后往东北经浮阳","0","2","2"
"后往东北经浮阳县","0","2","2"
"往东北经浮阳县西","0","2","2"
"东北经浮阳县西面","0","2","2"
"女思谷水发源于西","0","2","2"
"思谷水发源于西南","0","2","2"
"水发源于西南的女","0","2","2"
"发源于西南的女思","0","2","2"
"源于西南的女思涧","0","2","2"
"汇流处称为三会口","0","2","2"
"水又往东流经武阳","0","2","2"
"又往东流经武阳城","0","2","2"
"汉景帝中元二年前","0","2","2"
"浑塘沟水发源于遒","0","2","2"
"塘沟水发源于遒县","0","2","2"
"沟水发源于遒县西","0","2","2"
"水发源于遒县西边","0","2","2"
"发源于遒县西边白","0","2","2"
"源于遒县西边白马","0","2","2"
"于遒县西边白马山","0","2","2"
"遒县西边白马山的","0","2","2"
"县西边白马山的南","0","2","2"
"西边白马山的南溪","0","2","2"
"石泉水发源于石泉","0","2","2"
"泉水发源于石泉固","0","2","2"
"水发源于石泉固东","0","2","2"
"发源于石泉固东南","0","2","2"
"源于石泉固东南角","0","2","2"
"北易水往东流经容","0","2","2"
"易水往东流经容城","0","2","2"
"水往东流经容城县","0","2","2"
"经容城县老城北边","0","2","2"
"波涛滚滚地往东流","0","2","2"
"到勃海郡平舒县与","0","2","2"
"勃海郡平舒县与南","0","2","2"
"海郡平舒县与南易","0","2","2"
"郡平舒县与南易水","0","2","2"
"平舒县与南易水汇","0","2","2"
"舒县与南易水汇合","0","2","2"
"这里是中山简王焉","0","2","2"
"里是中山简王焉墓","0","2","2"
"是中山简王焉墓穴","0","2","2"
"中山简王焉墓穴的","0","2","2"
"山简王焉墓穴的所","0","2","2"
"简王焉墓穴的所在","0","2","2"
"王焉墓穴的所在地","0","2","2"
"采了琢郡的山石来","0","2","2"
"了琢郡的山石来修","0","2","2"
"琢郡的山石来修筑","0","2","2"
"郡的山石来修筑坟","0","2","2"
"的山石来修筑坟墓","0","2","2"
"水又往东流经容城","0","2","2"
"又往东流经容城县","0","2","2"
"把降于汉的匈奴王","0","2","2"
"降于汉的匈奴王唯","0","2","2"
"于汉的匈奴王唯徐","0","2","2"
"汉的匈奴王唯徐卢","0","2","2"
"的匈奴王唯徐卢封","0","2","2"
"匈奴王唯徐卢封于","0","2","2"
"奴王唯徐卢封于容","0","2","2"
"王唯徐卢封于容城","0","2","2"
"荆柯起身向他敬酒","0","2","2"
"壮士一去兮不复还","0","2","2"
"士一去兮不复还高","0","2","2"
"一去兮不复还高渐","0","2","2"
"去兮不复还高渐离","0","2","2"
"兮不复还高渐离击","0","2","2"
"不复还高渐离击筑","0","2","2"
"人们激动得头发直","0","2","2"
"们激动得头发直竖","0","2","2"
"把帽子都顶了起来","0","2","2"
"恒水从西方流来注","0","2","2"
"所说的望都县有委","0","2","2"
"说的望都县有委粟","0","2","2"
"的望都县有委粟关","0","2","2"
"把这地方封给中山","0","2","2"
"这地方封给中山靖","0","2","2"
"地方封给中山靖王","0","2","2"
"方封给中山靖王的","0","2","2"
"水又往东流经乡城","0","2","2"
"又往东流经乡城北","0","2","2"
"往东流经乡城北边","0","2","2"
"博水发源于望都县","0","2","2"
"往东南流经旧城南","0","2","2"
"东南流经旧城南边","0","2","2"
"蒲水又往东南流经","0","2","2"
"徐水又往东南流经","0","2","2"
"水又往东南流经石","0","2","2"
"又往东南流经石门","0","2","2"
"岐山之水发源于岐","0","2","2"
"山之水发源于岐山","0","2","2"
"往东流经邢安城北","0","2","2"
"东流经邢安城北边","0","2","2"
"又往东南流入曹河","0","2","2"
"这个源头出自南边","0","2","2"
"个源头出自南边的","0","2","2"
"源头出自南边的鸟","0","2","2"
"头出自南边的鸟鼠","0","2","2"
"出自南边的鸟鼠山","0","2","2"
"自南边的鸟鼠山渭","0","2","2"
"南边的鸟鼠山渭水","0","2","2"
"边的鸟鼠山渭水谷","0","2","2"
"所说的渭水发源于","0","2","2"
"说的渭水发源于鸟","0","2","2"
"的渭水发源于鸟鼠","0","2","2"
"渭水发源于鸟鼠山","0","2","2"
"渭水又往东南流经","0","2","2"
"往东北流经襄武县","0","2","2"
"和帝将彰县封给耿","0","2","2"
"帝将彰县封给耿秉","0","2","2"
"新兴县是南安郡的","0","2","2"
"兴县是南安郡的属","0","2","2"
"县是南安郡的属县","0","2","2"
"川水发源于西南山","0","2","2"
"水发源于西南山下","0","2","2"
"往西流注入瓦亭水","0","2","2"
"瓦亭水又往西南流","0","2","2"
"―诸水都发源于南","0","2","2"
"县的治所就在这里","0","2","2"
"清溪和白水从左右","0","2","2"
"溪和白水从左右两","0","2","2"
"和白水从左右两边","0","2","2"
"白水从左右两边注","0","2","2"
"水从左右两边注入","0","2","2"
"段溪水发源于西南","0","2","2"
"溪水发源于西南方","0","2","2"
"发源于西南方的马","0","2","2"
"源于西南方的马门","0","2","2"
"于西南方的马门溪","0","2","2"
"有莎谷水发源于南","0","2","2"
"莎谷水发源于南山","0","2","2"
"谷水发源于南山莎","0","2","2"
"水发源于南山莎溪","0","2","2"
"往西南注入东亭川","0","2","2"
"西南注入东亭川水","0","2","2"
"就是从那时开始的","0","2","2"
"从悬崖上直泻而下","0","2","2"
"轰隆之声震动山谷","0","2","2"
"中所说的太公垂钓","0","2","2"
"所说的太公垂钓处","0","2","2"
"说的太公垂钓处的","0","2","2"
"的太公垂钓处的兹","0","2","2"
"太公垂钓处的兹泉","0","2","2"
"哼川水发源于哼县","0","2","2"
"川水发源于哼县老","0","2","2"
"水发源于哼县老城","0","2","2"
"发源于哼县老城南","0","2","2"
"源于哼县老城南边","0","2","2"
"这就是王莽时的哼","0","2","2"
"就是王莽时的哼张","0","2","2"
"从北边接纳了鱼水","0","2","2"
"道人就是王莽时的","0","2","2"
"人就是王莽时的道","0","2","2"
"就是王莽时的道仁","0","2","2"
"代城东五十里有到","0","2","2"
"城东五十里有到刺","0","2","2"
"东五十里有到刺山","0","2","2"
"山上生有优质大黄","0","2","2"
"到刺山水往西北流","0","2","2"
"刺山水往西北流注","0","2","2"
"山水往西北流注入","0","2","2"
"水往西北流注入连","0","2","2"
"往西北流注入连水","0","2","2"
"汉高祖十二年俘虏","0","2","2"
"高祖十二年俘虏了","0","2","2"
"祖十二年俘虏了赵","0","2","2"
"十二年俘虏了赵王","0","2","2"
"就把赵国改设为郡","0","2","2"
"神泉水发源于苇壁","0","2","2"
"泉水发源于苇壁山","0","2","2"
"水发源于苇壁山北","0","2","2"
"发源于苇壁山北麓","0","2","2"
"流经一座老城东面","0","2","2"
"又往东流经三会亭","0","2","2"
"往东流经三会亭北","0","2","2"
"东流经三会亭北面","0","2","2"
"于延水又往东流经","0","2","2"
"平乡川水发源于平","0","2","2"
"乡川水发源于平乡","0","2","2"
"川水发源于平乡亭","0","2","2"
"水发源于平乡亭西","0","2","2"
"发源于平乡亭西面","0","2","2"
"两条水都发源于夷","0","2","2"
"条水都发源于夷舆","0","2","2"
"水都发源于夷舆县","0","2","2"
"都发源于夷舆县老","0","2","2"
"发源于夷舆县老城","0","2","2"
"源于夷舆县老城的","0","2","2"
"于夷舆县老城的西","0","2","2"
"夷舆县老城的西南","0","2","2"
"舆县老城的西南面","0","2","2"
"王莽时称为朔调亭","0","2","2"
"往东流经广阳县老","0","2","2"
"东流经广阳县老城","0","2","2"
"流经广阳县老城北","0","2","2"
"经广阳县老城北面","0","2","2"
"到光寿元年九月二","0","2","2"
"光寿元年九月二十","0","2","2"
"寿元年九月二十日","0","2","2"
"元年九月二十日刻","0","2","2"
"九月二十日刻石立","0","2","2"
"月二十日刻石立碑","0","2","2"
"流经槐里县老城南","0","2","2"
"经槐里县老城南边","0","2","2"
"渭水又往东北流经","0","2","2"
"一条北流注入渭水","0","2","2"
"渭水又往东流经长","0","2","2"
"水又往东流经长安","0","2","2"
"一条往北流与渭水","0","2","2"
"条往北流与渭水汇","0","2","2"
"往北流与渭水汇合","0","2","2"
"又往东流经成帝延","0","2","2"
"往东流经成帝延陵","0","2","2"
"东流经成帝延陵南","0","2","2"
"流经成帝延陵南边","0","2","2"
"支渠往东南流经藕","0","2","2"
"渠往东南流经藕原","0","2","2"
"往东南流经藕原下","0","2","2"
"又往东流经郭县老","0","2","2"
"往东流经郭县老城","0","2","2"
"东流经郭县老城北","0","2","2"
"流经郭县老城北边","0","2","2"
"取龟骨来占卜吉凶","0","2","2"
"发源于南方的马岭","0","2","2"
"源于南方的马岭山","0","2","2"
"水发源于南方的太","0","2","2"
"水发源于良乡县西","0","2","2"
"发源于良乡县西北","0","2","2"
"源于良乡县西北的","0","2","2"
"于良乡县西北的大","0","2","2"
"良乡县西北的大防","0","2","2"
"乡县西北的大防山","0","2","2"
"县西北的大防山南","0","2","2"
"西北的大防山南麓","0","2","2"
"往东流经琢县老城","0","2","2"
"魏时把这地方封给","0","2","2"
"时把这地方封给刘","0","2","2"
"把这地方封给刘放","0","2","2"
