"N-gram","原文","翻译","Total"
"水又往东北流经西","0","2","2"
"桑谷水发源于南方","0","2","2"
"水发源于南方的桑","0","2","2"
"发源于南方的桑溪","0","2","2"
"檐车水发源于檐车","0","2","2"
"车水发源于檐车删","0","2","2"
"往东南流经圣人城","0","2","2"
"东南流经圣人城南","0","2","2"
"南流经圣人城南面","0","2","2"
"沫水又往东南流经","0","2","2"
"藏刀山层岩陡峭耸","0","2","2"
"刀山层岩陡峭耸立","0","2","2"
"远望好像无数的刀","0","2","2"
"望好像无数的刀堆","0","2","2"
"好像无数的刀堆在","0","2","2"
"像无数的刀堆在一","0","2","2"
"无数的刀堆在一起","0","2","2"
"刀环靠着刀环一把","0","2","2"
"环靠着刀环一把把","0","2","2"
"靠着刀环一把把排","0","2","2"
"着刀环一把把排列","0","2","2"
"刀环一把把排列着","0","2","2"
"旧河道在这里分出","0","2","2"
"武里水发源于南方","0","2","2"
"里水发源于南方的","0","2","2"
"水发源于南方的武","0","2","2"
"发源于南方的武里","0","2","2"
"源于南方的武里山","0","2","2"
"又往东流经高门城","0","2","2"
"溪水发源于松阳山","0","2","2"
"直谷水发源于南山","0","2","2"
"往北流经屯城西面","0","2","2"
"水发源于南面的金","0","2","2"
"发源于南面的金门","0","2","2"
"源于南面的金门山","0","2","2"
"涧水发源于西北方","0","2","2"
"又往东南流经宜阳","0","2","2"
"往东南流经宜阳县","0","2","2"
"东南流经宜阳县老","0","2","2"
"南流经宜阳县老城","0","2","2"
"李谷水出自西北方","0","2","2"
"谷水出自西北方的","0","2","2"
"水出自西北方的李","0","2","2"
"出自西北方的李溪","0","2","2"
"现在洛阳太仓中的","0","2","2"
"在洛阳太仓中的大","0","2","2"
"洛阳太仓中的大坟","0","2","2"
"这两条水往东注入","0","2","2"
"两条水往东注入干","0","2","2"
"条水往东注入干金","0","2","2"
"水往东注入干金渠","0","2","2"
"又往东流过洛阳县","0","2","2"
"往东流过洛阳县南","0","2","2"
"东流过洛阳县南面","0","2","2"
"是周时王瓷以内的","0","2","2"
"绳都不能朝南望祭","0","2","2"
"水又往东北流经伏","0","2","2"
"涓水发源于陆浑西","0","2","2"
"水发源于陆浑西山","0","2","2"
"南水源出西山七谷","0","2","2"
"因而往东流经县城","0","2","2"
"而往东流经县城南","0","2","2"
"往东流经县城南面","0","2","2"
"斜水发源于武功县","0","2","2"
"山上冬夏都积雪不","0","2","2"
"上冬夏都积雪不化","0","2","2"
"又往南流经胡城东","0","2","2"
"往南流经胡城东边","0","2","2"
"邓公泉发源于邓艾","0","2","2"
"公泉发源于邓艾祠","0","2","2"
"泉发源于邓艾祠北","0","2","2"
"几个源头都从雍县","0","2","2"
"个源头都从雍县老","0","2","2"
"源头都从雍县老城","0","2","2"
"头都从雍县老城南","0","2","2"
"都从雍县老城南边","0","2","2"
"从雍县老城南边流","0","2","2"
"雍县老城南边流出","0","2","2"
"雍水又往南流经美","0","2","2"
"水发源于杜阳县的","0","2","2"
"蔺相如则要秦王击","0","2","2"
"相如则要秦王击击","0","2","2"
"就像两块巨大的磨","0","2","2"
"像两块巨大的磨石","0","2","2"
"世人称波水为百答","0","2","2"
"人称波水为百答水","0","2","2"
"沿渠多紫石和纹石","0","2","2"
"非山水发源于非山","0","2","2"
"山水发源于非山东","0","2","2"
"水发源于非山东麓","0","2","2"
"发源于非山东麓的","0","2","2"
"源于非山东麓的山","0","2","2"
"于非山东麓的山谷","0","2","2"
"转弯沿山两边往西","0","2","2"
"弯沿山两边往西流","0","2","2"
"又往西南流经宜君","0","2","2"
"往西南流经宜君川","0","2","2"
"世人又称为宜君水","0","2","2"
"铜官水发源于县城","0","2","2"
"官水发源于县城东","0","2","2"
"水发源于县城东北","0","2","2"
"往西南流经铜官川","0","2","2"
"沮水往东注入郑渠","0","2","2"
"往东南流入易荆水","0","2","2"
"湿余水又往东南流","0","2","2"
"大谷水发源于镇北","0","2","2"
"谷水发源于镇北大","0","2","2"
"水发源于镇北大谷","0","2","2"
"发源于镇北大谷溪","0","2","2"
"往西南流经独石北","0","2","2"
"西南流经独石北界","0","2","2"
"七度水发源于北山","0","2","2"
"度水发源于北山黄","0","2","2"
"水发源于北山黄颁","0","2","2"
"发源于北山黄颁谷","0","2","2"
"流经渔阳县老城南","0","2","2"
"经渔阳县老城南面","0","2","2"
"水又往南流经潞县","0","2","2"
"清河是众河的末尾","0","2","2"
"大榆河又往东南流","0","2","2"
"鲍丘水又往南流经","0","2","2"
"鲍丘水又往西南流","0","2","2"
"丘水又往西南流经","0","2","2"
"又往西南流经犷平","0","2","2"
"自蓟县西北流经昌","0","2","2"
"蓟县西北流经昌平","0","2","2"
"县西北流经昌平县","0","2","2"
"东至渔阳潞县为止","0","2","2"
"其间渠道所经四五","0","2","2"
"间渠道所经四五百","0","2","2"
"渠道所经四五百里","0","2","2"
"鲍丘水又往东流经","0","2","2"
"丘水又往东流经雍","0","2","2"
"水又往东流经雍奴","0","2","2"
"又往东流经雍奴县","0","2","2"
"往东流经雍奴县北","0","2","2"
"东流经雍奴县北面","0","2","2"
"霍光的封地在北海","0","2","2"
"光的封地在北海河","0","2","2"
"的封地在北海河东","0","2","2"
"五百沟水发源于七","0","2","2"
"百沟水发源于七山","0","2","2"
"沟水发源于七山北","0","2","2"
"水发源于七山北麓","0","2","2"
"往东流经平谷县的","0","2","2"
"东流经平谷县的映","0","2","2"
"流经平谷县的映城","0","2","2"
"经平谷县的映城南","0","2","2"
"平谷县的映城南面","0","2","2"
"泉水发源于北山温","0","2","2"
"水发源于北山温溪","0","2","2"
"连渊水发源于老城","0","2","2"
"渊水发源于老城以","0","2","2"
"水发源于老城以东","0","2","2"
"往西北流经老城南","0","2","2"
"西北流经老城南面","0","2","2"
"又往西北流经绿水","0","2","2"
"往西北流经绿水池","0","2","2"
"西北流经绿水池南","0","2","2"
"黄洛水发源于北面","0","2","2"
"洛水发源于北面的","0","2","2"
"发源于北面的卢龙","0","2","2"
"源于北面的卢龙山","0","2","2"
"旧河道在雍奴县承","0","2","2"
"河道在雍奴县承接","0","2","2"
"道在雍奴县承接鲍","0","2","2"
"在雍奴县承接鲍丘","0","2","2"
"雍奴县承接鲍丘水","0","2","2"
"水发源于新安平县","0","2","2"
"把该县封给摇母余","0","2","2"
"城川水发源于西南","0","2","2"
"流经一座老城西面","0","2","2"
"白狼水又往东北流","0","2","2"
"就是王莽时的禽虏","0","2","2"
"自鲁水从西北远山","0","2","2"
"鲁水从西北远山流","0","2","2"
"水从西北远山流来","0","2","2"
"往东南注入白狼水","0","2","2"
"又往南流经营丘城","0","2","2"
"往南流经营丘城西","0","2","2"
"南流经营丘城西面","0","2","2"
"大梁水发源于塞外","0","2","2"
"与北溪汇合成一条","0","2","2"
"北溪汇合成一条溪","0","2","2"
"溪汇合成一条溪流","0","2","2"
"丹水又往东北注入","0","2","2"
"水又往东北注入河","0","2","2"
"又往东北注入河水","0","2","2"
"河水是不可能远远","0","2","2"
"水是不可能远远流","0","2","2"
"是不可能远远流过","0","2","2"
"不可能远远流过皮","0","2","2"
"可能远远流过皮氏","0","2","2"
"能远远流过皮氏县","0","2","2"
"水发源于西北的梁","0","2","2"
"发源于西北的梁山","0","2","2"
"皇甫士安认为舜制","0","2","2"
"甫士安认为舜制陶","0","2","2"
"士安认为舜制陶器","0","2","2"
"安认为舜制陶器是","0","2","2"
"认为舜制陶器是在","0","2","2"
"为舜制陶器是在定","0","2","2"
"舜制陶器是在定陶","0","2","2"
"但陶城在蒲坂城以","0","2","2"
"陶城在蒲坂城以北","0","2","2"
"蒲坂城就是舜建都","0","2","2"
"坂城就是舜建都的","0","2","2"
"城就是舜建都的地","0","2","2"
"就是舜建都的地方","0","2","2"
"往北流过皇天原东","0","2","2"
"北流过皇天原东边","0","2","2"
"往南流经河北县旧","0","2","2"
"南流经河北县旧城","0","2","2"
"流经河北县旧城西","0","2","2"
"经河北县旧城西边","0","2","2"
"这里是旧时的魏国","0","2","2"
"永乐溪水又往南流","0","2","2"
"门水又往东北流经","0","2","2"
"又往东北流经邑川","0","2","2"
"水发源于常柔之山","0","2","2"
"安阳溪水发源于石","0","2","2"
"阳溪水发源于石蜻","0","2","2"
"溪水发源于石蜻南","0","2","2"
"水发源于石蜻南边","0","2","2"
"往西流经安阳城南","0","2","2"
"西流经安阳城南边","0","2","2"
"所说的从巅转进入","0","2","2"
"左边那匹拉车的马","0","2","2"
"涧水发源于石人岭","0","2","2"
"水发源于石人岭脚","0","2","2"
"发源于石人岭脚下","0","2","2"
"又往南流过奸苗以","0","2","2"
"往南流过奸苗以北","0","2","2"
"南流过奸苗以北的","0","2","2"
"流过奸苗以北的马","0","2","2"
"过奸苗以北的马头","0","2","2"
"奸苗以北的马头山","0","2","2"
"往西南流经垣县老","0","2","2"
"西南流经垣县老城","0","2","2"
"南流经垣县老城北","0","2","2"
"流经垣县老城北边","0","2","2"
"教水发源于垣县以","0","2","2"
"水发源于垣县以北","0","2","2"
"发源于垣县以北的","0","2","2"
"源于垣县以北的教","0","2","2"
"于垣县以北的教山","0","2","2"
"渐江水发源于三天","0","2","2"
"它发源于丹阳黔县","0","2","2"
"发源于丹阳黔县的","0","2","2"
"源于丹阳黔县的南","0","2","2"
"于丹阳黔县的南蛮","0","2","2"
"丹阳黔县的南蛮地","0","2","2"
"阳黔县的南蛮地区","0","2","2"
"浙江又东北流经过","0","2","2"
"树下有十二块方石","0","2","2"
"所说的把三苗放逐","0","2","2"
"说的把三苗放逐到","0","2","2"
"的把三苗放逐到三","0","2","2"
"把三苗放逐到三危","0","2","2"
"县南七里有鸣沙山","0","2","2"
"溳水发源于蔡阳县","0","2","2"
"该县东北还有阳山","0","2","2"
"县东北还有阳山老","0","2","2"
"东北还有阳山老城","0","2","2"
"就是长沙孝王的儿","0","2","2"
"是长沙孝王的儿子","0","2","2"
"长沙孝王的儿子宗","0","2","2"
"沙孝王的儿子宗的","0","2","2"
"孝王的儿子宗的食","0","2","2"
"王的儿子宗的食邑","0","2","2"
"旧时属江津长管辖","0","2","2"
"原来执掌各州郡去","0","2","2"
"来执掌各州郡去洛","0","2","2"
"执掌各州郡去洛阳","0","2","2"
"掌各州郡去洛阳朝","0","2","2"
"各州郡去洛阳朝贡","0","2","2"
"州郡去洛阳朝贡时","0","2","2"
"郡去洛阳朝贡时在","0","2","2"
"去洛阳朝贡时在此","0","2","2"
"洛阳朝贡时在此过","0","2","2"
"阳朝贡时在此过渡","0","2","2"
"川水发源于西南方","0","2","2"
"洧水又在右边与菠","0","2","2"
"水又在右边与菠破","0","2","2"
"又在右边与菠破水","0","2","2"
"在右边与菠破水汇","0","2","2"
"右边与菠破水汇合","0","2","2"
"又往东北流经中牟","0","2","2"
"就是禹的父亲变化","0","2","2"
"是禹的父亲变化的","0","2","2"
"禹的父亲变化的地","0","2","2"
"的父亲变化的地方","0","2","2"
"雍水又与东水汇合","0","2","2"
"逆流水发源于东南","0","2","2"
"流水发源于东南方","0","2","2"
"向右转弯然后往东","0","2","2"
"右转弯然后往东南","0","2","2"
"转弯然后往东南流","0","2","2"
"弯然后往东南流奔","0","2","2"
