"N-gram","原文","翻译","Total"
"命宣政殿学士杨佶为","0","2","2"
"册封皇后萧氏为贞懿","0","2","2"
"派同知析津府事耶律","0","2","2"
"耶律敌烈等出使夏国","0","2","2"
"六符为长宁军节度使","0","2","2"
"阻卜酋长乌八派其子","0","2","2"
"派使者前来进贡土产","0","2","2"
"卜大王屯秃古斯率领","0","2","2"
"大王屯秃古斯率领诸","0","2","2"
"王屯秃古斯率领诸部","0","2","2"
"屯秃古斯率领诸部酋","0","2","2"
"秃古斯率领诸部酋长","0","2","2"
"古斯率领诸部酋长前","0","2","2"
"斯率领诸部酋长前来","0","2","2"
"追赠他为同中书门下","0","2","2"
"赠他为同中书门下平","0","2","2"
"他为同中书门下平章","0","2","2"
"阿萨兰派使者前来进","0","2","2"
"萨兰派使者前来进贡","0","2","2"
"夏国李谅祚派使者前","0","2","2"
"国李谅祚派使者前来","0","2","2"
"殿前都点检萧迭里得","0","2","2"
"夏国派使者前来朝贺","0","2","2"
"尊皇太后为太皇太后","0","2","2"
"为参知政事兼同知枢","0","2","2"
"参知政事兼同知枢密","0","2","2"
"知政事兼同知枢密院","0","2","2"
"任命左夷离毕萧谟鲁","0","2","2"
"命左夷离毕萧谟鲁为","0","2","2"
"上尊号为慈懿仁和文","0","2","2"
"尊号为慈懿仁和文惠","0","2","2"
"号为慈懿仁和文惠孝","0","2","2"
"为慈懿仁和文惠孝敬","0","2","2"
"慈懿仁和文惠孝敬广","0","2","2"
"懿仁和文惠孝敬广爱","0","2","2"
"仁和文惠孝敬广爱宗","0","2","2"
"和文惠孝敬广爱宗天","0","2","2"
"任命楚国王涅鲁古为","0","2","2"
"任命隋王耶律仁先为","0","2","2"
"耶律乙辛为南院枢密","0","2","2"
"律乙辛为南院枢密使","0","2","2"
"御临永安殿录用进士","0","2","2"
"派使者进献回鹘僧人","0","2","2"
"国派使者前来感谢封","0","2","2"
"派使者前来感谢封册","0","2","2"
"夏国王李秉常派使者","0","2","2"
"萧挞不也为北府宰相","0","2","2"
"耶律慎思为北院枢密","0","2","2"
"律慎思为北院枢密副","0","2","2"
"慎思为北院枢密副使","0","2","2"
"死罪以下的杂罪犯人","0","2","2"
"前来馈赠其先帝遗物","0","2","2"
"萧挞不也为南院枢密","0","2","2"
"挞不也为南院枢密使","0","2","2"
"事耶律那也为知右夷","0","2","2"
"耶律那也为知右夷离","0","2","2"
"律那也为知右夷离毕","0","2","2"
"那也为知右夷离毕事","0","2","2"
"夏国王李乾顺派使者","0","2","2"
"李乾顺派使者奉上其","0","2","2"
"乾顺派使者奉上其父","0","2","2"
"派使者赠送鹿脯给宋","0","2","2"
"以南院大王萧特末为","0","2","2"
"即派遣使者前往吊唁","0","2","2"
"派遣使者前往吊唁祭","0","2","2"
"遣使者前往吊唁祭祀","0","2","2"
"参知政事赵孝严为汉","0","2","2"
"知政事赵孝严为汉人","0","2","2"
"政事赵孝严为汉人行","0","2","2"
"事赵孝严为汉人行宫","0","2","2"
"赵孝严为汉人行宫都","0","2","2"
"孝严为汉人行宫都部","0","2","2"
"严为汉人行宫都部署","0","2","2"
"参知政事牛温舒兼任","0","2","2"
"奏称攻讨梅里急告捷","0","2","2"
"征召医巫闾山僧人志","0","2","2"
"召医巫闾山僧人志达","0","2","2"
"兼任契丹行宫都部署","0","2","2"
"里底为知北院枢密使","0","2","2"
"底为知北院枢密使事","0","2","2"
"派使者请求皇上下嫁","0","2","2"
"使者请求皇上下嫁公","0","2","2"
"者请求皇上下嫁公主","0","2","2"
"兀纳为辽兴军节度使","0","2","2"
"以宋魏国王和鲁斡为","0","2","2"
"派使者请求下嫁公主","0","2","2"
"以族女南仙封为成安","0","2","2"
"族女南仙封为成安公","0","2","2"
"女南仙封为成安公主","0","2","2"
"归还所侵占的夏国土","0","2","2"
"还所侵占的夏国土地","0","2","2"
"生女真酋长在千里以","0","2","2"
"女真酋长在千里以内","0","2","2"
"真酋长在千里以内者","0","2","2"
"高丽派使者前来感谢","0","2","2"
"便奏称东征溃败之军","0","2","2"
"北院枢密使萧得里底","0","2","2"
"派遣乌林答赞谟带着","0","2","2"
"遣乌林答赞谟带着书","0","2","2"
"金国再次派遣乌林答","0","2","2"
"国再次派遣乌林答赞","0","2","2"
"再次派遣乌林答赞谟","0","2","2"
"回离保为知北院枢密","0","2","2"
"在夜里包围了忽汗城","0","2","2"
"又让牌印郎君萧讹都","0","2","2"
"让牌印郎君萧讹都斡","0","2","2"
"败张敬达军于太原北","0","2","2"
"惕隐刘哥及其弟盆都","0","2","2"
"随从枢密使耶律斜轸","0","2","2"
"升任同政事门下平章","0","2","2"
"任同政事门下平章事","0","2","2"
"随从枢密使耶律世良","0","2","2"
"从枢密使耶律世良讨","0","2","2"
"枢密使耶律世良讨伐","0","2","2"
"担任汉人行宫副部署","0","2","2"
"耶律查剌上次告发耶","0","2","2"
"律查剌上次告发耶律","0","2","2"
"查剌上次告发耶律撒","0","2","2"
"剌上次告发耶律撒剌","0","2","2"
"上次告发耶律撒剌等","0","2","2"
"曷鲁为迭剌部夷离堇","0","2","2"
"京留守宿国王陈留为","0","2","2"
"淳钦皇后弟阿古只五","0","2","2"
"钦皇后弟阿古只五世","0","2","2"
"皇后弟阿古只五世孙","0","2","2"
