"N-gram","原文","翻译","Total"
"见江面上冒出一个妇","0","2","2"
"江面上冒出一个妇女","0","2","2"
"面上冒出一个妇女和","0","2","2"
"上冒出一个妇女和一","0","2","2"
"冒出一个妇女和一个","0","2","2"
"出一个妇女和一个男","0","2","2"
"一个妇女和一个男人","0","2","2"
"这里有生人接着就在","0","2","2"
"里有生人接着就在江","0","2","2"
"有生人接着就在江面","0","2","2"
"生人接着就在江面上","0","2","2"
"人接着就在江面上跑","0","2","2"
"接着就在江面上跑了","0","2","2"
"着就在江面上跑了起","0","2","2"
"就在江面上跑了起来","0","2","2"
"远看岛上有山川城郭","0","2","2"
"但从来没见过这个岛","0","2","2"
"从来没见过这个岛子","0","2","2"
"我听说鬼国就在这个","0","2","2"
"听说鬼国就在这个岛","0","2","2"
"说鬼国就在这个岛上","0","2","2"
"今天幸亏我二哥来才","0","2","2"
"天幸亏我二哥来才证","0","2","2"
"幸亏我二哥来才证明","0","2","2"
"亏我二哥来才证明我","0","2","2"
"我二哥来才证明我是","0","2","2"
"二哥来才证明我是人","0","2","2"
"过去我一直被外甥们","0","2","2"
"去我一直被外甥们当","0","2","2"
"我一直被外甥们当作","0","2","2"
"一直被外甥们当作鬼","0","2","2"
"所以当地人不敢登上","0","2","2"
"以当地人不敢登上塔","0","2","2"
"当地人不敢登上塔顶","0","2","2"
"在手里直接就裂开了","0","2","2"
"孝义坊西边的原野上","0","2","2"
"或者看到有人坐在房","0","2","2"
"者看到有人坐在房檐","0","2","2"
"看到有人坐在房檐上","0","2","2"
"也被贬为巴陵郡别驾","0","2","2"
"两扇忽然合到柳氏头","0","2","2"
"扇忽然合到柳氏头上","0","2","2"
"共有四个人长期结伴","0","2","2"
"有四个人长期结伴而","0","2","2"
"四个人长期结伴而行","0","2","2"
"智圆也就可怜她而答","0","2","2"
"圆也就可怜她而答应","0","2","2"
"也就可怜她而答应了","0","2","2"
"乡里有一个人死了将","0","2","2"
"里有一个人死了将近","0","2","2"
"有一个人死了将近几","0","2","2"
"一个人死了将近几天","0","2","2"
"一位老婢女的头发也","0","2","2"
"位老婢女的头发也落","0","2","2"
"老婢女的头发也落光","0","2","2"
"婢女的头发也落光了","0","2","2"
"人们也因此而器重他","0","2","2"
"忽然有个穿白衣服的","0","2","2"
"吕御史是魏国的从事","0","2","2"
"御史是魏国的从事官","0","2","2"
"她只是心口有点温热","0","2","2"
"他们选择吉日下彩礼","0","2","2"
"听到妻子兄弟号哭和","0","2","2"
"一个穿绿衣拿竹简的","0","2","2"
"个穿绿衣拿竹简的人","0","2","2"
"告诉大使放司马回去","0","2","2"
"问他为什么杀两头牛","0","2","2"
"既然是你兄派你杀牛","0","2","2"
"张瑶的名字已被盖上","0","2","2"
"瑶的名字已被盖上了","0","2","2"
"很多罪人正在遭受报","0","2","2"
"多罪人正在遭受报应","0","2","2"
"两具尸体头朝东裸身","0","2","2"
"具尸体头朝东裸身躺","0","2","2"
"尸体头朝东裸身躺卧","0","2","2"
"于是卖掉家中所有的","0","2","2"
"是卖掉家中所有的财","0","2","2"
"卖掉家中所有的财产","0","2","2"
"就成了一块水中大陆","0","2","2"
"成了一块水中大陆地","0","2","2"
"三年后要埋葬他们时","0","2","2"
"看见灵柩上化作两个","0","2","2"
"见灵柩上化作两个人","0","2","2"
"有时相互拥抱好象躺","0","2","2"
"时相互拥抱好象躺卧","0","2","2"
"相互拥抱好象躺卧睡","0","2","2"
"互拥抱好象躺卧睡觉","0","2","2"
"拥抱好象躺卧睡觉时","0","2","2"
"抱好象躺卧睡觉时一","0","2","2"
"好象躺卧睡觉时一样","0","2","2"
"装五石粮的瓮那么大","0","2","2"
"恐怕会引来不可预测","0","2","2"
"怕会引来不可预测的","0","2","2"
"会引来不可预测的大","0","2","2"
"引来不可预测的大祸","0","2","2"
"来不可预测的大祸啊","0","2","2"
"六千三百一十二个月","0","2","2"
"山下流通的九十九眼","0","2","2"
"下流通的九十九眼泉","0","2","2"
"流通的九十九眼泉水","0","2","2"
"山峡中的水就是宜春","0","2","2"
"峡中的水就是宜春江","0","2","2"
"时常有破败的船木从","0","2","2"
"常有破败的船木从井","0","2","2"
"有破败的船木从井水","0","2","2"
"破败的船木从井水中","0","2","2"
"败的船木从井水中浮","0","2","2"
"的船木从井水中浮出","0","2","2"
"这口井的水不能饮用","0","2","2"
"辗转流落到楚州安宜","0","2","2"
"转流落到楚州安宜县","0","2","2"
"可以照见人的五脏六","0","2","2"
"以照见人的五脏六腑","0","2","2"
"树主一州的吉凶祸福","0","2","2"
"那诗就是韩愈出关时","0","2","2"
"诗就是韩愈出关时所","0","2","2"
"就是韩愈出关时所作","0","2","2"
"是韩愈出关时所作的","0","2","2"
"韩愈出关时所作的诗","0","2","2"
"愈出关时所作的诗中","0","2","2"
"出关时所作的诗中的","0","2","2"
"关时所作的诗中的一","0","2","2"
"时所作的诗中的一联","0","2","2"
"雪拥蓝关马不前十四","0","2","2"
"拥蓝关马不前十四个","0","2","2"
"蓝关马不前十四个字","0","2","2"
"三百年叶子落尽而生","0","2","2"
"百年叶子落尽而生花","0","2","2"
"开花结实之后便枯死","0","2","2"
"佛林国叫它阿梨诃咃","0","2","2"
"于是他亲自赶回家来","0","2","2"
"有一个人面狗身的东","0","2","2"
"一个人面狗身的东西","0","2","2"
"个人面狗身的东西从","0","2","2"
"人面狗身的东西从树","0","2","2"
"面狗身的东西从树中","0","2","2"
"狗身的东西从树中钻","0","2","2"
"身的东西从树中钻出","0","2","2"
"的东西从树中钻出来","0","2","2"
"笔者不知道他叫什么","0","2","2"
"者不知道他叫什么名","0","2","2"
"于是方士听说有干旱","0","2","2"
"是方士听说有干旱的","0","2","2"
"方士听说有干旱的地","0","2","2"
"士听说有干旱的地方","0","2","2"
"就是洞庭龙王的女儿","0","2","2"
"经过瞿塘峡滟滪堆滩","0","2","2"
"过瞿塘峡滟滪堆滩时","0","2","2"
"他就让水精沉到水底","0","2","2"
"去看看水底到底有多","0","2","2"
"看看水底到底有多深","0","2","2"
"穿碧色衣服的人把他","0","2","2"
"碧色衣服的人把他领","0","2","2"
"色衣服的人把他领到","0","2","2"
"衣服的人把他领到一","0","2","2"
"观内的古井里有一条","0","2","2"
"内的古井里有一条鱼","0","2","2"
"这个地方贫瘠而且寒","0","2","2"
"个地方贫瘠而且寒冷","0","2","2"
"他自己挺身上了大树","0","2","2"
"为什么要躲藏在草莽","0","2","2"
"什么要躲藏在草莽之","0","2","2"
"么要躲藏在草莽之中","0","2","2"
"嘹亮的笛声散漫山谷","0","2","2"
"不多时来了一个虎头","0","2","2"
"多时来了一个虎头人","0","2","2"
"时来了一个虎头人身","0","2","2"
"来了一个虎头人身的","0","2","2"
"了一个虎头人身的东","0","2","2"
"一个虎头人身的东西","0","2","2"
"张逢就把衣服脱下来","0","2","2"
"逢就把衣服脱下来挂","0","2","2"
"就把衣服脱下来挂到","0","2","2"
"把衣服脱下来挂到树","0","2","2"
"衣服脱下来挂到树上","0","2","2"
"就象野兽翻转踩踏的","0","2","2"
"象野兽翻转踩踏的样","0","2","2"
"野兽翻转踩踏的样子","0","2","2"
"的尸体忽然变成一只","0","2","2"
"她这才极力走了五六","0","2","2"
"这才极力走了五六里","0","2","2"
"听到山中伐木的声音","0","2","2"
"有木室关护得非常牢","0","2","2"
"木室关护得非常牢固","0","2","2"
"必须召来咬人的那条","0","2","2"
"须召来咬人的那条蛇","0","2","2"
"可是肌肉骨头全化成","0","2","2"
"是肌肉骨头全化成水","0","2","2"
"王思同的心腹将领王","0","2","2"
"思同的心腹将领王彦","0","2","2"
"同的心腹将领王彦晖","0","2","2"
"的心腹将领王彦晖及","0","2","2"
"心腹将领王彦晖及其","0","2","2"
"腹将领王彦晖及其手","0","2","2"
"将领王彦晖及其手下","0","2","2"
"领王彦晖及其手下的","0","2","2"
"王彦晖及其手下的人","0","2","2"
"一起投降到岐阳城里","0","2","2"
"起投降到岐阳城里去","0","2","2"
"王思同单人一骑逃走","0","2","2"
"最后竟死在朝廷的事","0","2","2"
"后竟死在朝廷的事业","0","2","2"
"竟死在朝廷的事业上","0","2","2"
"非法的吴国的寿州节","0","2","2"
"法的吴国的寿州节度","0","2","2"
"的吴国的寿州节度使","0","2","2"
"可以用柏树枝插进它","0","2","2"
"以用柏树枝插进它的","0","2","2"
"用柏树枝插进它的头","0","2","2"
"柏树枝插进它的头里","0","2","2"
"用新鲜荷叶裹着放在","0","2","2"
"新鲜荷叶裹着放在屏","0","2","2"
"鲜荷叶裹着放在屏风","0","2","2"
"荷叶裹着放在屏风后","0","2","2"
"叶裹着放在屏风后面","0","2","2"
"搜查出来后惩罚了偷","0","2","2"
"查出来后惩罚了偷肉","0","2","2"
"出来后惩罚了偷肉的","0","2","2"
"来后惩罚了偷肉的人","0","2","2"
"其中有的雉雀嗉子空","0","2","2"
"中有的雉雀嗉子空空","0","2","2"
"有的雉雀嗉子空空的","0","2","2"
"的雉雀嗉子空空的没","0","2","2"
"雉雀嗉子空空的没吃","0","2","2"
"雀嗉子空空的没吃食","0","2","2"
"百姓认为是义雀就不","0","2","2"
"姓认为是义雀就不杀","0","2","2"
"认为是义雀就不杀它","0","2","2"
"壳上有青色和绿色的","0","2","2"
"上有青色和绿色的斑","0","2","2"
"有青色和绿色的斑点","0","2","2"
"大的能装下二升的东","0","2","2"
"的能装下二升的东西","0","2","2"
"壳内光滑晶莹象云母","0","2","2"
"内光滑晶莹象云母一","0","2","2"
"光滑晶莹象云母一样","0","2","2"
"在肚子的下面有两个","0","2","2"
"肚子的下面有两个乳","0","2","2"
"子的下面有两个乳房","0","2","2"
"雌雄的阴物阳物都类","0","2","2"
"雄的阴物阳物都类似","0","2","2"
"的阴物阳物都类似人","0","2","2"
"捉住它的幼鱼放到岸","0","2","2"
"住它的幼鱼放到岸上","0","2","2"
"照着看书或织布的时","0","2","2"
"着看书或织布的时候","0","2","2"
"看书或织布的时候光","0","2","2"
"书或织布的时候光亮","0","2","2"
"或织布的时候光亮就","0","2","2"
"织布的时候光亮就昏","0","2","2"
"布的时候光亮就昏暗","0","2","2"
"照着欢乐的地方就明","0","2","2"
"着欢乐的地方就明亮","0","2","2"
"于是县城沦陷成为深","0","2","2"
"是县城沦陷成为深沟","0","2","2"
"县城沦陷成为深沟湖","0","2","2"
"城沦陷成为深沟湖泊","0","2","2"
"刘彦回和家人商量说","0","2","2"
"龟本来是有灵性的动","0","2","2"
"本来是有灵性的动物","0","2","2"
"样子象是个神灵于是","0","2","2"
"三十多口人跟随着乌","0","2","2"
"十多口人跟随着乌龟","0","2","2"
"多口人跟随着乌龟行","0","2","2"
"口人跟随着乌龟行走","0","2","2"
"也不知道究竟是什么","0","2","2"
"不知道究竟是什么原","0","2","2"
"知道究竟是什么原因","0","2","2"
"大王为何向一只发怒","0","2","2"
"王为何向一只发怒的","0","2","2"
"为何向一只发怒的蛤","0","2","2"
"何向一只发怒的蛤蟆","0","2","2"
"向一只发怒的蛤蟆作","0","2","2"
"一只发怒的蛤蟆作揖","0","2","2"
"从前经常捕捉无辜百","0","2","2"
"前经常捕捉无辜百姓","0","2","2"
"怪哉怪哉大概是感动","0","2","2"
"哉怪哉大概是感动了","0","2","2"
"怪哉大概是感动了上","0","2","2"
"哉大概是感动了上天","0","2","2"
"由这怨愤之气凝聚而","0","2","2"
"这怨愤之气凝聚而生","0","2","2"
"怨愤之气凝聚而生成","0","2","2"
"愤之气凝聚而生成的","0","2","2"
"里边满满的全是蝼蛄","0","2","2"
"大厅的匾额上写着审","0","2","2"
"厅的匾额上写着审雨","0","2","2"
"的匾额上写着审雨堂","0","2","2"
"提升为中书侍郎平章","0","2","2"
"升为中书侍郎平章事","0","2","2"
"躺在堂屋东面的走廊","0","2","2"
"在堂屋东面的走廊里","0","2","2"
"幽深的树林和水池子","0","2","2"
"忽听山头上有叫喊声","0","2","2"
"已有一千多巨人追来","0","2","2"
"有一千多巨人追来了","0","2","2"
"都络绎不绝地下山来","0","2","2"
"不一会儿就到了海岸","0","2","2"
"他们的妇女怀孕七个","0","2","2"
"们的妇女怀孕七个月","0","2","2"
"的妇女怀孕七个月就","0","2","2"
"妇女怀孕七个月就生","0","2","2"
"女怀孕七个月就生孩","0","2","2"
"怀孕七个月就生孩子","0","2","2"
"这一天国王到避风台","0","2","2"
"一天国王到避风台游","0","2","2"
"天国王到避风台游玩","0","2","2"
"也能明了书中的深刻","0","2","2"
"能明了书中的深刻含","0","2","2"
"明了书中的深刻含义","0","2","2"
"了书中的深刻含义和","0","2","2"
"书中的深刻含义和高","0","2","2"
"中的深刻含义和高妙","0","2","2"
"的深刻含义和高妙的","0","2","2"
"深刻含义和高妙的道","0","2","2"
"刻含义和高妙的道理","0","2","2"
"并以善心感化民间的","0","2","2"
"以善心感化民间的人","0","2","2"
"我就把仙客托付给你","0","2","2"
"就把仙客托付给你了","0","2","2"
"报了父亲和丈夫的冤","0","2","2"
"了父亲和丈夫的冤仇","0","2","2"
"我开始时看见一个人","0","2","2"
"还可以因为修建时间","0","2","2"
"可以因为修建时间长","0","2","2"
"以因为修建时间长了","0","2","2"
"何况是囚犯自己上吊","0","2","2"
"况是囚犯自己上吊而","0","2","2"
"是囚犯自己上吊而死","0","2","2"
"囚犯自己上吊而死呢","0","2","2"
"有一个人向他讨要三","0","2","2"
"一个人向他讨要三百","0","2","2"
"个人向他讨要三百千","0","2","2"
"人向他讨要三百千钱","0","2","2"
"司徒杜佑罢官回淮海","0","2","2"
"可以由前代继承下来","0","2","2"
"唐德宗看到收复城池","0","2","2"
"德宗看到收复城池的","0","2","2"
"宗看到收复城池的捷","0","2","2"
"看到收复城池的捷报","0","2","2"
"到收复城池的捷报上","0","2","2"
"收复城池的捷报上写","0","2","2"
"复城池的捷报上写着","0","2","2"
"臣已经清除宫室之乱","0","2","2"
"这人我一指就得倒下","0","2","2"
"岸上见有数十人家村","0","2","2"
"上见有数十人家村落","0","2","2"
