"N-gram","原文","翻译","Total"
"不知道是什么地方人","0","5","5"
"不知到什么地方去了","0","5","5"
"大魏真君二年七月七","2","2","4"
"魏真君二年七月七日","2","2","4"
"谏议大夫李行修娶江","2","2","4"
"议大夫李行修娶江西","2","2","4"
"大夫李行修娶江西廉","2","2","4"
"夫李行修娶江西廉使","2","2","4"
"李行修娶江西廉使王","2","2","4"
"行修娶江西廉使王仲","2","2","4"
"修娶江西廉使王仲舒","2","2","4"
"不知他到什么地方去","0","4","4"
"知他到什么地方去了","0","4","4"
"不知道是什么地方的","0","4","4"
"知道是什么地方的人","0","4","4"
"华州剌史礼部尚书徽","1","2","3"
"北边二十多里的地方","0","3","3"
"不是人世间所能有的","0","3","3"
"不明白他的话是什么","0","3","3"
"明白他的话是什么意","0","3","3"
"白他的话是什么意思","0","3","3"
"不知道他是从哪里来","0","3","3"
"知道他是从哪里来的","0","3","3"
"参加选拔进士的考试","0","3","3"
"不知道他去了什么地","0","3","3"
"知道他去了什么地方","0","3","3"
"迦叶佛讲说佛法的地","0","3","3"
"叶佛讲说佛法的地方","0","3","3"
"阿育王的第四个女儿","0","3","3"
"唐玄宗开元二十三年","0","3","3"
"不知道这是什么原因","0","3","3"
"不知道他叫什么名字","0","3","3"
"让亲家母空口来空口","0","3","3"
"亲家母空口来空口去","0","3","3"
"见一个穿红衣服的人","0","3","3"
"屏住呼吸靠意念行事","0","3","3"
"听到你召唤我的声音","0","3","3"
"时节使杜公亚重药术","2","0","2"
"常淮阴令吴兴沈生善","2","0","2"
"陈通方登正元进士第","2","0","2"
"荆宝时遣玉箫彼应奉","2","0","2"
"长春宫判官召入内庭","2","0","2"
"天令宰相举尚书郎一","2","0","2"
"令宰相举尚书郎一人","2","0","2"
"福州观察使寄乐妓十","2","0","2"
"州观察使寄乐妓十人","2","0","2"
"长女嫁汴州参军崔延","2","0","2"
"幼女嫁前开封尉李馹","2","0","2"
"主人唯供诸商贩顾周","2","0","2"
"元康二年壬子八月十","1","1","2"
"康二年壬子八月十五","1","1","2"
"二年壬子八月十五日","1","1","2"
"九州都仙大使高明主","1","1","2"
"州都仙大使高明主者","1","1","2"
"检校礼部郎中汴州观","1","1","2"
"校礼部郎中汴州观察","1","1","2"
"礼部郎中汴州观察判","1","1","2"
"部郎中汴州观察判官","1","1","2"
"蔚州横野军北极高四","1","1","2"
"州横野军北极高四十","1","1","2"
"横野军北极高四十度","1","1","2"
"日影长一丈五尺八分","1","1","2"
"洛州殖业坊王戎墓北","1","1","2"
"州殖业坊王戎墓北第","1","1","2"
"殖业坊王戎墓北第一","1","1","2"
"业坊王戎墓北第一铺","1","1","2"
"寄地文府正郎蔡伯喈","1","1","2"
"常州录事参军李哲家","1","1","2"
"雍州醴泉县人杨师操","1","1","2"
"贞元九年十一月二十","1","1","2"
"元九年十一月二十八","1","1","2"
"九年十一月二十八日","1","1","2"
"左神策军四军军使王","1","1","2"
"神策军四军军使王卞","1","1","2"
"度世君司马生乘龙车","1","1","2"
"弟子禽滑厘等三百人","1","1","2"
"东晋孝武帝太康二年","1","1","2"
"晋孝武帝太康二年八","1","1","2"
"孝武帝太康二年八月","1","1","2"
"武帝太康二年八月一","1","1","2"
"帝太康二年八月一日","1","1","2"
"兖州曲阜县高平乡九","1","1","2"
"州曲阜县高平乡九原","1","1","2"
"曲阜县高平乡九原里","1","1","2"
"景龙四年辛亥三月九","1","1","2"
"龙四年辛亥三月九日","1","1","2"
"太上西北库中镇中华","1","1","2"
"上西北库中镇中华二","1","1","2"
"西北库中镇中华二十","1","1","2"
"北库中镇中华二十四","1","1","2"
"库中镇中华二十四宝","1","1","2"
"河西陇左军城覆屯交","1","1","2"
"西陇左军城覆屯交兵","1","1","2"
"陇左军城覆屯交兵使","1","1","2"
"蓬莱霞明观丁尊师新","1","1","2"
"十大洞天三十六小洞","1","1","2"
"大洞天三十六小洞天","1","1","2"
"洞天三十六小洞天数","1","1","2"
"侍谋军国天下兵马元","1","1","2"
"谋军国天下兵马元帅","1","1","2"
"军国天下兵马元帅府","1","1","2"
"国天下兵马元帅府行","1","1","2"
"天下兵马元帅府行军","1","1","2"
"下兵马元帅府行军长","1","1","2"
"兵马元帅府行军长史","1","1","2"
"朝散大夫检校秘书少","1","1","2"
"散大夫检校秘书少监","1","1","2"
"镜湖山慈心仙人修道","1","1","2"
"阿母女态盈娘子跻虚","1","1","2"
"母女态盈娘子跻虚龙","1","1","2"
"邠帅朱玫立襄王监国","1","1","2"
"灵宝清斋告谢天地仪","1","1","2"
"后堂前染白牡丹一丛","1","1","2"
"二十三年五月五日午","1","1","2"
"十三年五月五日午时","1","1","2"
"汉武帝元封元年七月","1","1","2"
"武帝元封元年七月七","1","1","2"
"帝元封元年七月七日","1","1","2"
"元封元年七月七日夜","1","1","2"
"汉宣帝地节四年乙卯","1","1","2"
"徊风混合万景炼神飞","1","1","2"
"风混合万景炼神飞化","1","1","2"
"安期先生烧金液丹法","1","1","2"
"受真人太师紫元夫人","1","1","2"
"取织成裙衫两裆遗超","1","1","2"
"洪州高安县东四十里","1","1","2"
"开元二十四年春二月","1","1","2"
"开元二十一年壬申十","1","1","2"
"元二十一年壬申十一","1","1","2"
"二十一年壬申十一月","1","1","2"
"十一年壬申十一月三","1","1","2"
"一年壬申十一月三日","1","1","2"
"黄梅县女道士张连翘","1","1","2"
"虢州湖城小里正吴清","1","1","2"
"虢州阌乡县长寿乡天","1","1","2"
"州阌乡县长寿乡天仙","1","1","2"
"阌乡县长寿乡天仙村","1","1","2"
"大中八年八月十八日","1","1","2"
"大中十年丙子八月十","1","1","2"
"中十年丙子八月十日","1","1","2"
"十年丙子八月十日升","1","1","2"
"剡县白鹤观道士陶蒉","1","1","2"
"县白鹤观道士陶蒉云","1","1","2"
"魏夫人仙坛精修香火","1","1","2"
"常州义兴县湖洑渚桂","1","1","2"
"州义兴县湖洑渚桂岩","1","1","2"
"义兴县湖洑渚桂岩山","1","1","2"
"咸通十五年七月十四","1","1","2"
"通十五年七月十四日","1","1","2"
"广州监军吴德鄘离京","1","1","2"
"仪同三司襄阳侯王浚","1","1","2"
"同三司襄阳侯王浚敬","1","1","2"
"三司襄阳侯王浚敬造","1","1","2"
"帝诤居殿命肾公敏谈","2","0","2"
"诤居殿命肾公敏谈论","2","0","2"
"居殿命肾公敏谈论苦","2","0","2"
"御史中丞河西陇右节","1","1","2"
"史中丞河西陇右节度","1","1","2"
"中丞河西陇右节度使","1","1","2"
"中书侍郎同中书门下","1","1","2"
"书侍郎同中书门下平","1","1","2"
"侍郎同中书门下平章","1","1","2"
"郎同中书门下平章事","1","1","2"
"优田王旃檀像师第四","1","1","2"
"弟子惠远等四百余人","1","1","2"
"遣庶子秦州刺史太原","1","1","2"
"庶子秦州刺史太原公","1","1","2"
"弘始十一年八月二十","1","1","2"
"始十一年八月二十日","1","1","2"
"北岱清凉山文殊师利","1","1","2"
"南海循州北山兴宁县","1","1","2"
"开元二十三年六月二","1","1","2"
"元二十三年六月二十","1","1","2"
"二十三年六月二十三","1","1","2"
"十三年六月二十三日","1","1","2"
"泗州临淮县信义坊乞","1","1","2"
"相州西山中住持竹林","1","1","2"
"州西山中住持竹林寺","1","1","2"
"晋泰始二年五月十五","1","1","2"
"泰始二年五月十五日","1","1","2"
"长安城内通轨坊三卫","1","1","2"
"安城内通轨坊三卫刘","1","1","2"
"城内通轨坊三卫刘公","1","1","2"
"内通轨坊三卫刘公信","1","1","2"
"左清道率府府史李思","1","1","2"
"清道率府府史李思元","1","1","2"
"开元十四年五月二十","1","1","2"
"元十四年五月二十一","1","1","2"
"十四年五月二十一日","1","1","2"
"周武帝转金刚般若经","1","1","2"
"益州新繁县西四十里","1","1","2"
"州新繁县西四十里王","1","1","2"
"新繁县西四十里王李","1","1","2"
"繁县西四十里王李村","1","1","2"
"般若经灵验一十八条","1","1","2"
"岳州刺史丞相弘农公","1","1","2"
"汉州什邡县百姓王翰","1","1","2"
"开成三年七月十五日","1","1","2"
"大中九年四月十六日","1","1","2"
"中九年四月十六日忽","1","1","2"
"太始五年七月十三日","1","1","2"
"北方衔草寺须陁洹圣","1","1","2"
"方衔草寺须陁洹圣僧","1","1","2"
"妙法莲华经序品第一","1","1","2"
"元嘉九年三月二十七","1","1","2"
"嘉九年三月二十七日","1","1","2"
"冀州故观城人姜胜生","1","1","2"
"蜀广都县百姓陈弘泰","1","1","2"
"太元十四年五月五日","1","1","2"
"尚书令杨遵彦等五人","1","1","2"
"立梁元帝第九子晋安","1","1","2"
"梁元帝第九子晋安王","1","1","2"
"蜀宁江节度使王宗黯","1","1","2"
"徽投前洛阳令寇祖仁","2","0","2"
"明庭观道士刘仁宽说","1","1","2"
"汾州孝义县泉村人刘","1","1","2"
"州孝义县泉村人刘摩","1","1","2"
"开元二年五月二十九","1","1","2"
"元二年五月二十九日","1","1","2"
"范阳节度使朱克融猎","1","1","2"
"江南通事舍人王慎辞","1","1","2"
"十三年中书侍郎平章","1","1","2"
"三年中书侍郎平章事","1","1","2"
"思温独携琴临水闲泛","2","0","2"
"道州司仓参军李全方","1","1","2"
"鄂州唐年县尉李全方","1","1","2"
"故中书令晋国公裴度","1","1","2"
"唐山南节判殿中侍御","1","1","2"
"山南节判殿中侍御史","1","1","2"
"南节判殿中侍御史樊","1","1","2"
"节判殿中侍御史樊阳","1","1","2"
"判殿中侍御史樊阳源","1","1","2"
"东京履信坊十字街西","1","1","2"
"京履信坊十字街西道","1","1","2"
"履信坊十字街西道北","1","1","2"
"户部尚书范阳卢承庆","1","1","2"
"故谏议大夫李行修娶","2","0","2"
"娶江西廉使王仲舒女","2","0","2"
"伪蜀拔山军卒李梦旗","1","1","2"
"大梁同州节度使刘知","1","1","2"
"梁同州节度使刘知俊","1","1","2"
"司空上党王长孙道生","1","1","2"
"后盈珍遣小使程务盈","2","0","2"
"时侍中张文瓘参军事","2","0","2"
"卫州新乡县令裴子云","1","1","2"
"河西陇右军覆屯交兵","1","1","2"
"西陇右军覆屯交兵使","1","1","2"
"令录土豪一门十余口","2","0","2"
"北使员外常侍李道固","1","1","2"
"刺史谯国公李崇义怪","1","1","2"
"唯刑部侍郎杨汝士诗","2","0","2"
"刑部侍郎杨汝士诗后","2","0","2"
"部侍郎杨汝士诗后成","2","0","2"
"殿中侍御史李行修举","1","1","2"
"闲居遣兴七言诗一百","1","1","2"
"居遣兴七言诗一百韵","1","1","2"
"御史中丞郎余庆弹奏","2","0","2"
"史中丞郎余庆弹奏免","2","0","2"
"始平县主簿刘体微分","1","1","2"
"左武卫大将军公孙武","1","1","2"
"武卫大将军公孙武达","1","1","2"
"娶滑亳节度使令狐章","1","1","2"
"尝客扬州惠照寺木兰","2","0","2"
"客扬州惠照寺木兰院","2","0","2"
"唐朱庆余遇水部郎中","2","0","2"
"朱庆余遇水部郎中张","2","0","2"
"庆余遇水部郎中张籍","2","0","2"
"余遇水部郎中张籍知","2","0","2"
"遇水部郎中张籍知音","2","0","2"
"索庆余新旧篇什数通","2","0","2"
"前进士陈玩等三人应","1","1","2"
"美人徐月华能弹卧箜","1","1","2"
"人徐月华能弹卧箜篌","1","1","2"
"晋平南将军后侍中王","1","1","2"
"平南将军后侍中王慄","1","1","2"
"骠骑将军豫章王嶷请","1","1","2"
"武陵王国将军吴兴太","1","1","2"
"陵王国将军吴兴太守","1","1","2"
"封广宁郡王尚书大司","1","1","2"
"广宁郡王尚书大司徒","1","1","2"
"宁郡王尚书大司徒同","1","1","2"
"郡王尚书大司徒同州","1","1","2"
"王尚书大司徒同州牧","1","1","2"
"任直阁将军员外散骑","1","1","2"
"直阁将军员外散骑侍","1","1","2"
"阁将军员外散骑侍郎","1","1","2"
"右手第二指剜鬼眼睛","1","1","2"
"七百四十九石二斗七","1","1","2"
"百四十九石二斗七合","1","1","2"
"六百九十七石七斗九","1","1","2"
"百九十七石七斗九升","1","1","2"
"收一千五百三十六枚","1","1","2"
"碗明年五月十六日巳","1","1","2"
"明年五月十六日巳时","1","1","2"
"江南吉州刺史张曜卿","1","1","2"
"国子司业知制诰崔融","1","1","2"
"小李少府作刑部员外","1","1","2"
"越州剡县尉窦公衡同","1","1","2"
"太上老君二月十五日","1","1","2"
"上老君二月十五日生","1","1","2"
"友人薛侠者获一铜剑","2","0","2"
"人薛侠者获一铜剑长","2","0","2"
"薛侠者获一铜剑长四","2","0","2"
"侠者获一铜剑长四尺","2","0","2"
"镂水晶玛瑙辟尘犀龙","2","0","2"
"水晶玛瑙辟尘犀龙凤","2","0","2"
"晶玛瑙辟尘犀龙凤花","2","0","2"
"玛瑙辟尘犀龙凤花木","2","0","2"
"瑙辟尘犀龙凤花木状","2","0","2"
"九经书史老庄八都赋","1","1","2"
"归德军节度使元行钦","1","1","2"
"沧州南皮县丞郭务静","1","1","2"
"益州新昌县令夏侯彪","1","1","2"
"取五月五日南墙下雪","1","1","2"
"京台监察院西行中间","1","1","2"
"年俊臣贼劫王庆诜女","2","0","2"
"率府兵曹参军冯光震","1","1","2"
"文昌右丞卢献等五人","1","1","2"
"时西番酋长大将军斛","1","1","2"
"西番酋长大将军斛瑟","1","1","2"
"番酋长大将军斛瑟罗","1","1","2"
"御史大夫魏元忠患病","1","1","2"
"诸州马步军都指挥使","1","1","2"
"瑕丘县进贤乡马青村","1","1","2"
"广陵秋夜读修所赋三","1","1","2"
"陵秋夜读修所赋三篇","1","1","2"
"白杨风哭兮石甃髯莎","1","1","2"
"衙中留功德山下奠长","2","0","2"
"将古忠臣烈士图共观","2","0","2"
"潜使左右置安道院香","1","1","2"
"樗蒲君遣婢迎僧坐斗","2","0","2"
"蒲君遣婢迎僧坐斗帐","2","0","2"
"君遣婢迎僧坐斗帐中","2","0","2"
"元嘉九年二月二十四","1","1","2"
"嘉九年二月二十四日","1","1","2"
"贞观十六年九月八日","1","1","2"
"命翰林学士韦处厚撰","1","1","2"
"广州显明寺道人法力","1","1","2"
"陈文帝天嘉元年二月","1","1","2"
"文帝天嘉元年二月二","1","1","2"
"帝天嘉元年二月二日","1","1","2"
"遂州长江县丞夏文荣","1","1","2"
"杨廷玉奉养老母残年","1","1","2"
"左卫率右骁卫将军左","1","1","2"
"卫率右骁卫将军左羽","1","1","2"
"率右骁卫将军左羽林","1","1","2"
"右骁卫将军左羽林将","1","1","2"
"骁卫将军左羽林将军","1","1","2"
"脚床七宝屏风黄金屈","1","1","2"
"床七宝屏风黄金屈膝","1","1","2"
"中书侍郎平章事元载","1","1","2"
"知馆官前凤州河池县","1","1","2"
"馆官前凤州河池县尉","1","1","2"
"官前凤州河池县尉刘","1","1","2"
"前凤州河池县尉刘俶","1","1","2"
"贞元十四年戊寅夏五","1","1","2"
"元十四年戊寅夏五月","1","1","2"
"华州下邽县东南三十","1","1","2"
"州下邽县东南三十余","1","1","2"
"下邽县东南三十余里","1","1","2"
"崇贤里法明寺僧普照","1","1","2"
"贤里法明寺僧普照门","1","1","2"
"里法明寺僧普照门徒","1","1","2"
"上都安邑坊十字街东","1","1","2"
"西市食店张家楼上坐","1","1","2"
"李戴仁尝维舟枝江县","2","0","2"
"戴仁尝维舟枝江县曲","2","0","2"
"仁尝维舟枝江县曲浦","2","0","2"
"尝维舟枝江县曲浦中","2","0","2"
"长子礼部尚书杨玄感","1","1","2"
"右监门卫录事参军张","1","1","2"
"监门卫录事参军张翰","1","1","2"
"新都县大道观老君旁","1","1","2"
"舒州司士参军黄仁浚","1","1","2"
"居延部落主勃都骨低","1","1","2"
"祖父母叔兄弟中外亲","1","1","2"
"父母叔兄弟中外亲族","1","1","2"
"楚王马希范修长沙城","1","1","2"
"汴州浚义县功曹范钦","1","1","2"
"蔡州上蔡县南里村百","1","1","2"
"州上蔡县南里村百姓","1","1","2"
"上蔡县南里村百姓李","1","1","2"
"蔡县南里村百姓李简","1","1","2"
"尚书刑部郎中宋行质","1","1","2"
"尚书都官令吏王璹暴","1","1","2"
"书都官令吏王璹暴死","1","1","2"
"十七年四月二十七日","1","1","2"
"十七年四月二十一日","1","1","2"
"七年四月二十一日受","1","1","2"
"年四月二十一日受替","1","1","2"
"雍州长安县人赵文若","1","1","2"
"括州刺史乐安任义方","1","1","2"
"蜀州刺史节度参谋李","1","1","2"
"州刺史节度参谋李思","1","1","2"
"刺史节度参谋李思恭","1","1","2"
"成都锦浦里北门内西","1","1","2"
"都锦浦里北门内西回","1","1","2"
"锦浦里北门内西回第","1","1","2"
"浦里北门内西回第一","1","1","2"
"里北门内西回第一宅","1","1","2"
"润州朝京门内染师张","1","1","2"
"建武四年三月十日庚","1","1","2"
"武四年三月十日庚寅","1","1","2"
"大同四年七月十二日","1","1","2"
"同四年七月十二日己","1","1","2"
"四年七月十二日己巳","1","1","2"
"一十八万六千四百日","1","1","2"
"故右补阙集贤殿直学","1","1","2"
"右补阙集贤殿直学士","1","1","2"
"补阙集贤殿直学士郑","1","1","2"
"阙集贤殿直学士郑钦","1","1","2"
"集贤殿直学士郑钦悦","1","1","2"
"后珠络衣褓玉龙子赐","2","0","2"
"珠络衣褓玉龙子赐焉","2","0","2"
"吴景帝永安三年七月","1","1","2"
"吴赤乌二年八月十日","1","1","2"
"赤乌二年八月十日子","1","1","2"
"乌二年八月十日子义","1","1","2"
"开元二十八年五月十","1","1","2"
"元二十八年五月十八","1","1","2"
"二十八年五月十八日","1","1","2"
"永泰元年东海弥罗国","1","1","2"
"建宁郡乌句山南五百","1","1","2"
"宁郡乌句山南五百里","1","1","2"
"魏郡临黄王国村人王","1","1","2"
"郡临黄王国村人王方","1","1","2"
"临黄王国村人王方言","1","1","2"
"武贲郎将段文操留守","1","1","2"
"段成式修行里思第书","1","1","2"
"成式修行里思第书斋","1","1","2"
"式修行里思第书斋前","1","1","2"
"慈恩寺唐三藏院后檐","1","1","2"
"恩寺唐三藏院后檐楷","1","1","2"
"折冲都尉沙门陀沙尼","1","1","2"
"冲都尉沙门陀沙尼拔","1","1","2"
"都尉沙门陀沙尼拔陀","1","1","2"
"盘豆馆东官道大槐树","1","1","2"
"豆馆东官道大槐树下","1","1","2"
"馆东官道大槐树下醉","1","1","2"
"东都留守判官祠部郎","1","1","2"
"都留守判官祠部郎中","1","1","2"
"留守判官祠部郎中范","1","1","2"
"守判官祠部郎中范阳","1","1","2"
"相国令狐楚居守北都","1","1","2"
"吴大帝赤乌三年七月","1","1","2"
"晋恭帝元熙元年七月","1","1","2"
"回环一十五里九十步","1","1","2"
"河南缑氏县东太子陵","1","1","2"
"南缑氏县东太子陵仙","1","1","2"
"缑氏县东太子陵仙鹤","1","1","2"
"氏县东太子陵仙鹤观","1","1","2"
"卢龙军节度使检校尚","1","1","2"
"龙军节度使检校尚书","1","1","2"
"军节度使检校尚书左","1","1","2"
"节度使检校尚书左仆","1","1","2"
"度使检校尚书左仆射","1","1","2"
"使检校尚书左仆射张","1","1","2"
"检校尚书左仆射张直","1","1","2"
"校尚书左仆射张直方","1","1","2"
"思同腹心都将王彦晖","2","0","2"
"同腹心都将王彦晖下","2","0","2"
"河南采访使汴州刺史","1","1","2"
"南采访使汴州刺史齐","1","1","2"
"采访使汴州刺史齐浣","1","1","2"
"碑文梁散骑常侍庾元","2","0","2"
"文梁散骑常侍庾元威","2","0","2"
"梁散骑常侍庾元威撰","2","0","2"
"后魏庄帝永安二年七","1","1","2"
"魏庄帝永安二年七月","1","1","2"
"庄帝永安二年七月二","1","1","2"
"帝永安二年七月二十","1","1","2"
"永安二年七月二十日","1","1","2"
"城北隔真珠江二十里","1","1","2"
"检校尚书金部员外郎","1","1","2"
"左骁卫胄曹参军卢倚","1","1","2"
"骁卫胄曹参军卢倚马","1","1","2"
"洪州李判官二十三郎","1","1","2"
"相李勉任江西观察使","1","1","2"
"李勉任江西观察使时","1","1","2"
"太极真人命北寒玉女","1","1","2"
"极真人命北寒玉女宋","1","1","2"
"真人命北寒玉女宋联","1","1","2"
"人命北寒玉女宋联涓","1","1","2"
"青童命东华玉女烟景","1","1","2"
"童命东华玉女烟景珠","1","1","2"
"旸谷神王命神林玉女","1","1","2"
"谷神王命神林玉女贾","1","1","2"
"神王命神林玉女贾屈","1","1","2"
"青虚真人命飞玄玉女","1","1","2"
"虚真人命飞玄玉女鲜","1","1","2"
"蜀金堂山龙桥峰下修","1","1","2"
"右金吾卫曹京兆韦知","1","1","2"
"金吾卫曹京兆韦知十","1","1","2"
"专心致志地念金刚般","1","1","2"
"心致志地念金刚般若","1","1","2"
"致志地念金刚般若经","1","1","2"
"永徽六年十月三日夜","1","1","2"
"开元三年任阆中县丞","1","1","2"
"诵金刚般若波罗密经","1","1","2"
"蒋州大归善寺释慧侃","1","1","2"
"主帅中书令李崇委任","1","1","2"
"交州都督遂安公李寿","1","1","2"
"汉武帝尝隐语召东方","2","0","2"
"武帝尝隐语召东方朔","2","0","2"
"曾勤任魏州馆陶县尉","1","1","2"
"凉州刺史尉成兴等六","1","1","2"
"刘志言任华州下邽县","1","1","2"
"遂州总管府记室参军","1","1","2"
"州总管府记室参军孔","1","1","2"
"总管府记室参军孔恪","1","1","2"
"大中五年辛未五月五","1","1","2"
"中五年辛未五月五日","1","1","2"
"陕州西北白径岭上逻","1","1","2"
"州西北白径岭上逻村","1","1","2"
"是个人迹不到的地方","0","2","2"
"于是他就走入皇宫苑","0","2","2"
"是他就走入皇宫苑囿","0","2","2"
"他就走入皇宫苑囿之","0","2","2"
"就走入皇宫苑囿之中","0","2","2"
"就舀江岸边的水把水","0","2","2"
"舀江岸边的水把水瓶","0","2","2"
"江岸边的水把水瓶加","0","2","2"
"岸边的水把水瓶加满","0","2","2"
"南昌国献给皇帝一个","0","2","2"
"昌国献给皇帝一个玳","0","2","2"
"国献给皇帝一个玳瑁","0","2","2"
"献给皇帝一个玳瑁盆","0","2","2"
"三四个人扯起手来合","0","2","2"
"四个人扯起手来合抱","0","2","2"
"个人扯起手来合抱才","0","2","2"
"人扯起手来合抱才能","0","2","2"
"扯起手来合抱才能把","0","2","2"
"起手来合抱才能把它","0","2","2"
"手来合抱才能把它围","0","2","2"
"来合抱才能把它围一","0","2","2"
"合抱才能把它围一圈","0","2","2"
"每三个叶生在枝条的","0","2","2"
"三个叶生在枝条的顶","0","2","2"
"个叶生在枝条的顶端","0","2","2"
"有一股紫气从昭德殿","0","2","2"
"一股紫气从昭德殿的","0","2","2"
"股紫气从昭德殿的东","0","2","2"
"紫气从昭德殿的东隅","0","2","2"
"气从昭德殿的东隅冒","0","2","2"
"从昭德殿的东隅冒出","0","2","2"
"昭德殿的东隅冒出来","0","2","2"
"张二师率领家人洒扫","0","2","2"
"二师率领家人洒扫这","0","2","2"
"师率领家人洒扫这个","0","2","2"
"率领家人洒扫这个院","0","2","2"
"领家人洒扫这个院子","0","2","2"
"家人洒扫这个院子的","0","2","2"
"人洒扫这个院子的时","0","2","2"
"洒扫这个院子的时候","0","2","2"
"在一根柱子上拾到了","0","2","2"
"一根柱子上拾到了一","0","2","2"
"根柱子上拾到了一个","0","2","2"
"柱子上拾到了一个小","0","2","2"
"子上拾到了一个小瓶","0","2","2"
"上拾到了一个小瓶子","0","2","2"
"详细地述说了这件事","0","2","2"
"他让人把那个人找来","0","2","2"
"贵人命令手下把郑宏","0","2","2"
"人命令手下把郑宏之","0","2","2"
"命令手下把郑宏之拖","0","2","2"
"令手下把郑宏之拖下","0","2","2"
"手下把郑宏之拖下来","0","2","2"
"他儿子又去请那道士","0","2","2"
"请不要用毒牙咬死我","0","2","2"
"你只要跟随着走不要","0","2","2"
"只要跟随着走不要舍","0","2","2"
"要跟随着走不要舍弃","0","2","2"
"跟随着走不要舍弃离","0","2","2"
"随着走不要舍弃离开","0","2","2"
"着走不要舍弃离开就","0","2","2"
"走不要舍弃离开就行","0","2","2"
"不要舍弃离开就行了","0","2","2"
"晚上回到母亲的肚子","0","2","2"
"上回到母亲的肚子里","0","2","2"
"你以后如有急难之事","0","2","2"
"使者随即赶着车进入","0","2","2"
"者随即赶着车进入洞","0","2","2"
"随即赶着车进入洞穴","0","2","2"
"即赶着车进入洞穴里","0","2","2"
"这里也就是槐安国的","0","2","2"
"里也就是槐安国的国","0","2","2"
"也就是槐安国的国都","0","2","2"
"然后又问了天宝十四","0","2","2"
"后又问了天宝十四年","0","2","2"
"又问了天宝十四年以","0","2","2"
"问了天宝十四年以后","0","2","2"
"了天宝十四年以后的","0","2","2"
"天宝十四年以后的事","0","2","2"
"无双已送进宫廷当了","0","2","2"
"双已送进宫廷当了奴","0","2","2"
"已送进宫廷当了奴婢","0","2","2"
"李齐运就派仙客去做","0","2","2"
"齐运就派仙客去做富","0","2","2"
"运就派仙客去做富平","0","2","2"
"就派仙客去做富平县","0","2","2"
"派仙客去做富平县尹","0","2","2"
"崔生作了一首诗的末","0","2","2"
"生作了一首诗的末句","0","2","2"
"作了一首诗的末句是","0","2","2"
"静悄悄地什么也看不","0","2","2"
"悄悄地什么也看不见","0","2","2"
"按时问安就像对待父","0","2","2"
"时问安就像对待父母","0","2","2"
"这人把驴拴到另一间","0","2","2"
"人把驴拴到另一间屋","0","2","2"
"把驴拴到另一间屋子","0","2","2"
"驴拴到另一间屋子里","0","2","2"
"安仲古死前曾对家里","0","2","2"
"仲古死前曾对家里人","0","2","2"
"古死前曾对家里人说","0","2","2"
"云顶山王已派来车马","0","2","2"
"顶山王已派来车马带","0","2","2"
"山王已派来车马带着","0","2","2"
