"N-gram","原文","翻译","Total"
"派使者祭祀太上皇于","0","2","2"
"使者祭祀太上皇于万","0","2","2"
"者祭祀太上皇于万年","0","2","2"
"七岁以上每人赐钱二","0","2","2"
"岁以上每人赐钱二千","0","2","2"
"诏令公卿以下各秘密","0","2","2"
"令公卿以下各秘密上","0","2","2"
"公卿以下各秘密上书","0","2","2"
"卿以下各秘密上书对","0","2","2"
"以下各秘密上书对国","0","2","2"
"命令天下在押囚犯没","0","2","2"
"令天下在押囚犯没有","0","2","2"
"天下在押囚犯没有判","0","2","2"
"下在押囚犯没有判决","0","2","2"
"在押囚犯没有判决的","0","2","2"
"永建元年春正月初二","0","2","2"
"流民自动归首的每人","0","2","2"
"民自动归首的每人一","0","2","2"
"自动归首的每人一级","0","2","2"
"护羌校尉马贤讨伐烧","0","2","2"
"羌校尉马贤讨伐烧当","0","2","2"
"校尉马贤讨伐烧当羌","0","2","2"
"无户口的流浪人想自","0","2","2"
"户口的流浪人想自归","0","2","2"
"口的流浪人想自归首","0","2","2"
"的流浪人想自归首的","0","2","2"
"在明堂祭祀光武皇帝","0","2","2"
"脚至髡钳城旦舂十匹","0","2","2"
"无户籍想归首的每人","0","2","2"
"户籍想归首的每人一","0","2","2"
"籍想归首的每人一级","0","2","2"
"刖右脚至髡钳城旦舂","0","2","2"
"于光烈皇后更衣别室","0","2","2"
"废皇太子刘庆为清河","0","2","2"
"皇太子刘庆为清河王","0","2","2"
"陈夫人为渤海孝王妃","0","2","2"
"一律下蚕室施以腐刑","0","2","2"
"司空张温为车骑将军","0","2","2"
