"N-gram","原文","翻译","Total"
"尚书裴行俭为定襄道大","0","2","2"
"书裴行俭为定襄道大总","0","2","2"
"率军讨伐突厥温傅部落","0","2","2"
"同州人民住户应该免除","0","2","2"
"州人民住户应该免除两","0","2","2"
"人民住户应该免除两年","0","2","2"
"民住户应该免除两年地","0","2","2"
"住户应该免除两年地税","0","2","2"
"河北遭水灾之处免地税","0","2","2"
"北遭水灾之处免地税一","0","2","2"
"遭水灾之处免地税一年","0","2","2"
"皇上诏令雍州长史李义","0","2","2"
"上诏令雍州长史李义玄","0","2","2"
"诏令雍州长史李义玄道","0","2","2"
"向天下表示朴素的本质","0","2","2"
"我们听说游手好闲的人","0","2","2"
"们听说游手好闲的人废","0","2","2"
"听说游手好闲的人废弃","0","2","2"
"说游手好闲的人废弃劳","0","2","2"
"游手好闲的人废弃劳作","0","2","2"
"手好闲的人废弃劳作事","0","2","2"
"好闲的人废弃劳作事业","0","2","2"
"难道她不知道还有奢侈","0","2","2"
"道她不知道还有奢侈华","0","2","2"
"她不知道还有奢侈华丽","0","2","2"
"不知道还有奢侈华丽的","0","2","2"
"知道还有奢侈华丽的服","0","2","2"
"道还有奢侈华丽的服饰","0","2","2"
"民间里巷的人公然穿戴","0","2","2"
"皇太子亲自陈设酒食以","0","2","2"
"太子亲自陈设酒食以祭","0","2","2"
"子亲自陈设酒食以祭奠","0","2","2"
"亲自陈设酒食以祭奠先","0","2","2"
"自陈设酒食以祭奠先圣","0","2","2"
"同三品刘仁轨兼任太子","0","2","2"
"三品刘仁轨兼任太子少","0","2","2"
"品刘仁轨兼任太子少傅","0","2","2"
"定襄道总管曹怀舜与突","0","2","2"
"襄道总管曹怀舜与突厥","0","2","2"
"道总管曹怀舜与突厥史","0","2","2"
"总管曹怀舜与突厥史伏","0","2","2"
"管曹怀舜与突厥史伏念","0","2","2"
"曹怀舜与突厥史伏念在","0","2","2"
"怀舜与突厥史伏念在横","0","2","2"
"舜与突厥史伏念在横水","0","2","2"
"与突厥史伏念在横水作","0","2","2"
"突厥史伏念在横水作战","0","2","2"
"已故江王元祥之子日卓","0","2","2"
"故江王元祥之子日卓因","0","2","2"
"江王元祥之子日卓因为","0","2","2"
"王元祥之子日卓因为违","0","2","2"
"元祥之子日卓因为违犯","0","2","2"
"祥之子日卓因为违犯名","0","2","2"
"之子日卓因为违犯名教","0","2","2"
"雍州起大风危害了庄稼","0","2","2"
"行俭大破突厥史伏念之","0","2","2"
"俭大破突厥史伏念之部","0","2","2"
"大破突厥史伏念之部众","0","2","2"
"史伏念因为程务挺追赶","0","2","2"
"伏念因为程务挺追赶太","0","2","2"
"念因为程务挺追赶太急","0","2","2"
"裴行俭于是全部平定了","0","2","2"
"行俭于是全部平定了突","0","2","2"
"俭于是全部平定了突厥","0","2","2"
"于是全部平定了突厥余","0","2","2"
"是全部平定了突厥余党","0","2","2"
"允许遭水灾的地方前往","0","2","2"
"许遭水灾的地方前往江","0","2","2"
"特别赦免定襄军以及为","0","2","2"
"别赦免定襄军以及为征","0","2","2"
"赦免定襄军以及为征讨","0","2","2"
"免定襄军以及为征讨突","0","2","2"
"定襄军以及为征讨突厥","0","2","2"
"襄军以及为征讨突厥不","0","2","2"
"军以及为征讨突厥不力","0","2","2"
"以及为征讨突厥不力的","0","2","2"
"及为征讨突厥不力的官","0","2","2"
"为征讨突厥不力的官吏","0","2","2"
"征讨突厥不力的官吏士","0","2","2"
"讨突厥不力的官吏士兵","0","2","2"
"突厥不力的官吏士兵等","0","2","2"
"厥不力的官吏士兵等人","0","2","2"
"仍以他的儿子政继承新","0","2","2"
"以他的儿子政继承新罗","0","2","2"
"他的儿子政继承新罗王","0","2","2"
"的儿子政继承新罗王位","0","2","2"
"永淳元年正月一日是朔","0","2","2"
"淳元年正月一日是朔日","0","2","2"
"因为太子诞生的皇孙满","0","2","2"
"为太子诞生的皇孙满月","0","2","2"
"改开耀二年为永淳元年","0","2","2"
"晋朝立愍怀太子之子为","0","2","2"
"朝立愍怀太子之子为太","0","2","2"
"立愍怀太子之子为太孙","0","2","2"
"齐国立文惠太子昭业为","0","2","2"
"国立文惠太子昭业为太","0","2","2"
"立文惠太子昭业为太孙","0","2","2"
"太孙便住在东宫而为实","0","2","2"
"孙便住在东宫而为实际","0","2","2"
"便住在东宫而为实际上","0","2","2"
"住在东宫而为实际上的","0","2","2"
"在东宫而为实际上的太","0","2","2"
"东宫而为实际上的太子","0","2","2"
"而皇太子健在然而却立","0","2","2"
"皇太子健在然而却立皇","0","2","2"
"太子健在然而却立皇太","0","2","2"
"子健在然而却立皇太孙","0","2","2"
"可以然而终竟不为皇太","0","2","2"
"以然而终竟不为皇太孙","0","2","2"
"然而终竟不为皇太孙开","0","2","2"
"而终竟不为皇太孙开府","0","2","2"
"终竟不为皇太孙开府建","0","2","2"
"竟不为皇太孙开府建署","0","2","2"
"跟从的士子百姓大多饿","0","2","2"
"从的士子百姓大多饿倒","0","2","2"
"的士子百姓大多饿倒在","0","2","2"
"士子百姓大多饿倒在路","0","2","2"
"子百姓大多饿倒在路上","0","2","2"
"以裴行俭为金牙道行军","0","2","2"
"裴行俭为金牙道行军大","0","2","2"
"行俭为金牙道行军大总","0","2","2"
"俭为金牙道行军大总管","0","2","2"
"与将军阎怀旦等三个总","0","2","2"
"将军阎怀旦等三个总管","0","2","2"
"军阎怀旦等三个总管分","0","2","2"
"阎怀旦等三个总管分几","0","2","2"
"怀旦等三个总管分几路","0","2","2"
"旦等三个总管分几路讨","0","2","2"
"等三个总管分几路讨伐","0","2","2"
"三个总管分几路讨伐十","0","2","2"
"个总管分几路讨伐十姓","0","2","2"
"总管分几路讨伐十姓突","0","2","2"
"管分几路讨伐十姓突厥","0","2","2"
"分几路讨伐十姓突厥阿","0","2","2"
"几路讨伐十姓突厥阿史","0","2","2"
"路讨伐十姓突厥阿史那","0","2","2"
"讨伐十姓突厥阿史那车","0","2","2"
"伐十姓突厥阿史那车薄","0","2","2"
"裴行俭尚未出师而去世","0","2","2"
"皇上驾到渑池之紫桂宫","0","2","2"
"皇上对参知政事崔知温","0","2","2"
"上对参知政事崔知温道","0","2","2"
"郭待举等人历任官职还","0","2","2"
"待举等人历任官职还浅","0","2","2"
"不能马上与你们同受一","0","2","2"
"能马上与你们同受一个","0","2","2"
"马上与你们同受一个职","0","2","2"
"上与你们同受一个职务","0","2","2"
"与你们同受一个职务称","0","2","2"
"你们同受一个职务称呼","0","2","2"
"从此宫外百官四品以下","0","2","2"
"此宫外百官四品以下任","0","2","2"
"宫外百官四品以下任知","0","2","2"
"外百官四品以下任知政","0","2","2"
"百官四品以下任知政事","0","2","2"
"官四品以下任知政事者","0","2","2"
"从十四日开始连续降下","0","2","2"
"十四日开始连续降下时","0","2","2"
"四日开始连续降下时雨","0","2","2"
"死亡者在道路上纵横交","0","2","2"
"亡者在道路上纵横交错","0","2","2"
"皇上诏令各所在地区的","0","2","2"
"上诏令各所在地区的官","0","2","2"
"诏令各所在地区的官府","0","2","2"
"令各所在地区的官府将","0","2","2"
"各所在地区的官府将他","0","2","2"
"所在地区的官府将他们","0","2","2"
"在地区的官府将他们埋","0","2","2"
"地区的官府将他们埋葬","0","2","2"
"以岐州刺史苏良嗣为雍","0","2","2"
"岐州刺史苏良嗣为雍州","0","2","2"
"州刺史苏良嗣为雍州长","0","2","2"
"刺史苏良嗣为雍州长史","0","2","2"
"京师人们互相残杀吞食","0","2","2"
"在嵩山之南建造奉天宫","0","2","2"
"黄门侍郎刘景先任同平","0","2","2"
"门侍郎刘景先任同平章","0","2","2"
"侍郎刘景先任同平章事","0","2","2"
"突厥残余党羽阿史那骨","0","2","2"
"厥残余党羽阿史那骨笃","0","2","2"
"残余党羽阿史那骨笃禄","0","2","2"
"余党羽阿史那骨笃禄等","0","2","2"
"党羽阿史那骨笃禄等人","0","2","2"
"羽阿史那骨笃禄等人招","0","2","2"
"阿史那骨笃禄等人招集","0","2","2"
"史那骨笃禄等人招集残","0","2","2"
"那骨笃禄等人招集残余","0","2","2"
"骨笃禄等人招集残余部","0","2","2"
"笃禄等人招集残余部众","0","2","2"
"左领军卫大将军薛仁贵","0","2","2"
"领军卫大将军薛仁贵去","0","2","2"
"军卫大将军薛仁贵去世","0","2","2"
"阿史德元珍等人包围单","0","2","2"
"史德元珍等人包围单于","0","2","2"
"德元珍等人包围单于都","0","2","2"
"元珍等人包围单于都护","0","2","2"
"珍等人包围单于都护府","0","2","2"
"彗星在五车北星座上出","0","2","2"
"星在五车北星座上出现","0","2","2"
"绥州部落稽白铁余占据","0","2","2"
"州部落稽白铁余占据城","0","2","2"
"部落稽白铁余占据城平","0","2","2"
"落稽白铁余占据城平县","0","2","2"
"稽白铁余占据城平县造","0","2","2"
"白铁余占据城平县造反","0","2","2"
"命令将军程务挺率兵讨","0","2","2"
"令将军程务挺率兵讨伐","0","2","2"
"将军程务挺率兵讨伐他","0","2","2"
"军程务挺率兵讨伐他们","0","2","2"
"丰州都督崔智辨率军从","0","2","2"
"州都督崔智辨率军从朝","0","2","2"
"都督崔智辨率军从朝那","0","2","2"
"督崔智辨率军从朝那山","0","2","2"
"崔智辨率军从朝那山出","0","2","2"
"智辨率军从朝那山出发","0","2","2"
"封皇孙重福为唐昌郡王","0","2","2"
"令唐昌郡王重福为京师","0","2","2"
"唐昌郡王重福为京师留","0","2","2"
"昌郡王重福为京师留守","0","2","2"
"平民房屋全被淹没冲走","0","2","2"
"南北两面土地全被破坏","0","2","2"
"当时天后从封泰山以后","0","2","2"
"每次皇上下诏书草拟礼","0","2","2"
"次皇上下诏书草拟礼节","0","2","2"
"皇上下诏书草拟礼节制","0","2","2"
"上下诏书草拟礼节制度","0","2","2"
"发生边境警急事件而后","0","2","2"
"生边境警急事件而后终","0","2","2"
"边境警急事件而后终止","0","2","2"
"现在又再次行分封嵩山","0","2","2"
"在又再次行分封嵩山之","0","2","2"
"又再次行分封嵩山之礼","0","2","2"
"皇上苦于头痛不可忍耐","0","2","2"
"想要在皇上头上刺出血","0","2","2"
"要在皇上头上刺出血来","0","2","2"
"在皇上头上刺出血来吗","0","2","2"
"皇上头上刺出血来吗皇","0","2","2"
"上头上刺出血来吗皇上","0","2","2"
"头上刺出血来吗皇上道","0","2","2"
"出血未必不好侍医就用","0","2","2"
"血未必不好侍医就用针","0","2","2"
"未必不好侍医就用针刺","0","2","2"
"必不好侍医就用针刺百","0","2","2"
"不好侍医就用针刺百会","0","2","2"
"命令将军程务挺为单于","0","2","2"
"令将军程务挺为单于道","0","2","2"
"将军程务挺为单于道安","0","2","2"
"军程务挺为单于道安抚","0","2","2"
"程务挺为单于道安抚大","0","2","2"
"务挺为单于道安抚大使","0","2","2"
"凭借招讨总管的身份讨","0","2","2"
"借招讨总管的身份讨伐","0","2","2"
"招讨总管的身份讨伐山","0","2","2"
"讨总管的身份讨伐山贼","0","2","2"
"总管的身份讨伐山贼元","0","2","2"
"管的身份讨伐山贼元珍","0","2","2"
"郭正一等人在东宫任同","0","2","2"
"正一等人在东宫任同平","0","2","2"
"一等人在东宫任同平章","0","2","2"
"等人在东宫任同平章事","0","2","2"
"宰相以下大臣都不能晋","0","2","2"
"相以下大臣都不能晋见","0","2","2"
"以下大臣都不能晋见皇","0","2","2"
"下大臣都不能晋见皇上","0","2","2"
"皇上想要亲自到则天门","0","2","2"
"上想要亲自到则天门楼","0","2","2"
"由于气不顺而不能上马","0","2","2"
"于是召百姓在殿前宣读","0","2","2"
"是召百姓在殿前宣读赦","0","2","2"
"召百姓在殿前宣读赦免","0","2","2"
"百姓在殿前宣读赦免书","0","2","2"
"没有一个人不感动喜悦","0","2","2"
"天神地神若延长我一两","0","2","2"
"神地神若延长我一两个","0","2","2"
"地神若延长我一两个月","0","2","2"
"神若延长我一两个月的","0","2","2"
"若延长我一两个月的命","0","2","2"
"军国大事有不能决断者","0","2","2"
"大将军兼内侍杨思勖讨","0","2","2"
"将军兼内侍杨思勖讨伐","0","2","2"
"令内外文武九品以上官","0","2","2"
"内外文武九品以上官员","0","2","2"
"前任灵州大都督府长史","0","2","2"
"令兵部尚书王思礼为副","0","2","2"
"元三年春正月一日是朔","0","2","2"
"宋节度使田神功前来朝","0","2","2"
"节度使田神功前来朝见","0","2","2"
"也在私人府第设宴招待","0","2","2"
"给予检校工部尚书的加","0","2","2"
"赦免天下被关押的囚犯","0","2","2"
"以左散骑常侍孟白皋为","0","2","2"
"十一年春正月一日是朔","0","2","2"
"一年春正月一日是朔日","0","2","2"
"十二年春正月一日是朔","0","2","2"
"十三年春正月一日是朔","0","2","2"
"主持吏部科举选拔之事","0","2","2"
"十四年春正月一日是朔","0","2","2"
"浙西观察使李德裕上奏","0","2","2"
"皇上至鱼藻宫观看舟船","0","2","2"
"上至鱼藻宫观看舟船竞","0","2","2"
"至鱼藻宫观看舟船竞渡","0","2","2"
"部尚书萧亻免为太子少","0","2","2"
"吏部尚书郑纟因为太子","0","2","2"
"部尚书郑纟因为太子少","0","2","2"
"李逢吉为宣武军节度使","0","2","2"
"任河阳三城怀州节度使","0","2","2"
"河中节度使李程为左仆","0","2","2"
"中节度使李程为左仆射","0","2","2"
"大和四年十一月十六日","0","2","2"
"检校右仆射兼吏部尚书","0","2","2"
"十六宅各位亲王的女儿","0","2","2"
"节度使李德裕为兵部尚","0","2","2"
"度使李德裕为兵部尚书","0","2","2"
"任原吏部尚书令狐楚为","0","2","2"
"原职同中书门下平章事","0","2","2"
"大理卿郭行余任宁节度","0","2","2"
"理卿郭行余任宁节度使","0","2","2"
"以太子宾客分管东都的","0","2","2"
"任较低职务的度支使王","0","2","2"
"成德军节度使王元逵为","0","2","2"
"兼任较小职务的度支使","0","2","2"
"位上兼同中书门下平章","0","2","2"
"上兼同中书门下平章事","0","2","2"
"兼任较低职务的户部事","0","2","2"
"皇上在曲江亭赐群臣宴","0","2","2"
"上在曲江亭赐群臣宴会","0","2","2"
"八年春正月一日是朔日","0","2","2"
"兼任职务较低的度支使","0","2","2"
"兼任较低职务度支使的","0","2","2"
"皇上赐给宰辅大臣及中","0","2","2"
"上赐给宰辅大臣及中书","0","2","2"
"门下两省供奉官在曲江","0","2","2"
"皇上在马瞞之山池赐群","0","2","2"
"上在马瞞之山池赐群臣","0","2","2"
"在马瞞之山池赐群臣宴","0","2","2"
"马瞞之山池赐群臣宴会","0","2","2"
"在马瞞山池赐群臣宴会","0","2","2"
"主持吏部博学宏词科考","0","2","2"
"持吏部博学宏词科考试","0","2","2"
"博学宏词科考试以选拔","0","2","2"
"学宏词科考试以选拔人","0","2","2"
"宏词科考试以选拔人才","0","2","2"
"暂时掌管礼部贡举事务","0","2","2"
"每八十文中分出十五文","0","2","2"
"大同军防御使卢简方为","0","2","2"
"任命吏部侍郎萧亻放为","0","2","2"
"皇上诏令南面招讨使马","0","2","2"
"上诏令南面招讨使马举","0","2","2"
"如果没有父兄子弟而有","0","2","2"
"果没有父兄子弟而有妻","0","2","2"
"没有父兄子弟而有妻女","0","2","2"
"有父兄子弟而有妻女的","0","2","2"
"和原来一样担任翰林学","0","2","2"
"原来一样担任翰林学士","0","2","2"
"吏部侍郎崔荛主持博学","0","2","2"
"部侍郎崔荛主持博学宏","0","2","2"
"侍郎崔荛主持博学宏词","0","2","2"
"郎崔荛主持博学宏词科","0","2","2"
"崔荛主持博学宏词科考","0","2","2"
"荛主持博学宏词科考试","0","2","2"
"皇上的车驾驻跸于成都","0","2","2"
"上的车驾驻跸于成都府","0","2","2"
"文武百官向皇帝敬奉徽","0","2","2"
"武百官向皇帝敬奉徽号","0","2","2"
"上驾临宣政殿接受册书","0","2","2"
"晋封阶官开府仪同三司","0","2","2"
"兼任同中书门下平章事","0","2","2"
"授予李怀光太子太保的","0","2","2"
"吐蕃宰相尚结赞在平凉","0","2","2"
"从兵部尚书崔汉衡以下","0","2","2"
"兼任魏州大都督府长史","0","2","2"
"任命山南东道节度使李","0","2","2"
"交给京兆府以杖刑处死","0","2","2"
"权德舆为检校吏部尚书","0","2","2"
"命山南东道节度使严绶","0","2","2"
"任命忠武军节度使李光","0","2","2"
"命忠武军节度使李光颜","0","2","2"
"任命前山南东道节度使","0","2","2"
"兼任太子少保分司东都","0","2","2"
"把谏议大夫李景俭贬职","0","2","2"
"谏议大夫李景俭贬职为","0","2","2"
"任命户部侍郎杨於陵为","0","2","2"
"中书省门下省同平章事","0","2","2"
"任命前天平军节度使马","0","2","2"
"命前天平军节度使马总","0","2","2"
"任命河东节度使裴度充","0","2","2"
"命河东节度使裴度充任","0","2","2"
"河东节度使裴度充任幽","0","2","2"
"州刺史李景俭为谏议大","0","2","2"
"刺史李景俭为谏议大夫","0","2","2"
"太白金星靠近太微西垣","0","2","2"
"魏博节度使田布上奏说","0","2","2"
"每贯分出二百文资助军","0","2","2"
"任命凤翔节度使李光颜","0","2","2"
"命凤翔节度使李光颜为","0","2","2"
"凤翔节度使李光颜为忠","0","2","2"
"翔节度使李光颜为忠武","0","2","2"
"李光颜为忠武军节度使","0","2","2"
"月出生在长安皇宫东边","0","2","2"
"出生在长安皇宫东边的","0","2","2"
"生在长安皇宫东边的宫","0","2","2"
"在长安皇宫东边的宫中","0","2","2"
"任命右金吾卫大将军范","0","2","2"
"命右金吾卫大将军范希","0","2","2"
"金吾卫大将军范希朝为","0","2","2"
"授予同中书门下平章事","0","2","2"
"予同中书门下平章事头","0","2","2"
"同中书门下平章事头衔","0","2","2"
"叔文交往密切而获罪受","0","2","2"
"文交往密切而获罪受到","0","2","2"
"交往密切而获罪受到处","0","2","2"
"往密切而获罪受到处分","0","2","2"
"中书门下御史台五品以","0","2","2"
"书门下御史台五品以上","0","2","2"
"宗祠庙里设置灵位陪同","0","2","2"
"祠庙里设置灵位陪同享","0","2","2"
"庙里设置灵位陪同享受","0","2","2"
"里设置灵位陪同享受祭","0","2","2"
"设置灵位陪同享受祭祀","0","2","2"
"母亲是文德顺圣长孙皇","0","2","2"
"亲是文德顺圣长孙皇后","0","2","2"
"不到任所而接受并州都","0","2","2"
"到任所而接受并州都督","0","2","2"
"任所而接受并州都督之","0","2","2"
"所而接受并州都督之职","0","2","2"
"开始由著作郎萧德言教","0","2","2"
"始由著作郎萧德言教授","0","2","2"
"退居在家想到弥补皇上","0","2","2"
"居在家想到弥补皇上的","0","2","2"
"在家想到弥补皇上的过","0","2","2"
"家想到弥补皇上的过错","0","2","2"
"悲哀思念之情感动左右","0","2","2"
"哀思念之情感动左右的","0","2","2"
"思念之情感动左右的人","0","2","2"
"不久被任命为右武候大","0","2","2"
"久被任命为右武候大将","0","2","2"
"被任命为右武候大将军","0","2","2"
"让他观看自己决断各种","0","2","2"
"他观看自己决断各种政","0","2","2"
"观看自己决断各种政务","0","2","2"
"等到太宗基本确定了发","0","2","2"
"到太宗基本确定了发兵","0","2","2"
"太宗基本确定了发兵日","0","2","2"
"宗基本确定了发兵日期","0","2","2"
"因而请求驿站飞马传递","0","2","2"
"而请求驿站飞马传递自","0","2","2"
"请求驿站飞马传递自己","0","2","2"
"求驿站飞马传递自己生","0","2","2"
"驿站飞马传递自己生活","0","2","2"
"站飞马传递自己生活工","0","2","2"
"飞马传递自己生活工作","0","2","2"
"马传递自己生活工作起","0","2","2"
"传递自己生活工作起居","0","2","2"
"递自己生活工作起居的","0","2","2"
"自己生活工作起居的表","0","2","2"
"己生活工作起居的表章","0","2","2"
"并传递边境情况的报告","0","2","2"
"当时太宗生了个大毒疮","0","2","2"
"扶着车辇步行跟从了几","0","2","2"
"着车辇步行跟从了几天","0","2","2"
"贞观二十三年五月二十","0","2","2"
"观二十三年五月二十六","0","2","2"
"二十三年五月二十六日","0","2","2"
"压死的人家各赐给绢绸","0","2","2"
"死的人家各赐给绢绸三","0","2","2"
"的人家各赐给绢绸三匹","0","2","2"
"英国公李责力为尚书左","0","2","2"
"国公李责力为尚书左仆","0","2","2"
"公李责力为尚书左仆射","0","2","2"
"赠梁国公房玄龄为太尉","0","2","2"
"以瑶池都督阿史那贺鲁","0","2","2"
"瑶池都督阿史那贺鲁为","0","2","2"
"池都督阿史那贺鲁为左","0","2","2"
"都督阿史那贺鲁为左骁","0","2","2"
"督阿史那贺鲁为左骁卫","0","2","2"
"阿史那贺鲁为左骁卫大","0","2","2"
"史那贺鲁为左骁卫大将","0","2","2"
"那贺鲁为左骁卫大将军","0","2","2"
"接受诸侯朝拜而不按时","0","2","2"
"受诸侯朝拜而不按时会","0","2","2"
"诸侯朝拜而不按时会见","0","2","2"
"确实是由于赏罚不公正","0","2","2"
"吐火罗派遣使者献大鸟","0","2","2"
"皇上派遣右武卫将军鲜","0","2","2"
"上派遣右武卫将军鲜于","0","2","2"
"派遣右武卫将军鲜于匡","0","2","2"
"遣右武卫将军鲜于匡济","0","2","2"
"右武卫将军鲜于匡济持","0","2","2"
"武卫将军鲜于匡济持皇","0","2","2"
"卫将军鲜于匡济持皇帝","0","2","2"
"将军鲜于匡济持皇帝书","0","2","2"
"军鲜于匡济持皇帝书信","0","2","2"
"鲜于匡济持皇帝书信前","0","2","2"
"于匡济持皇帝书信前往","0","2","2"
"匡济持皇帝书信前往吊","0","2","2"
"济持皇帝书信前往吊祭","0","2","2"
"右骁卫郎将高侃活捉车","0","2","2"
"骁卫郎将高侃活捉车鼻","0","2","2"
"卫郎将高侃活捉车鼻可","0","2","2"
"郎将高侃活捉车鼻可汗","0","2","2"
"将高侃活捉车鼻可汗送","0","2","2"
"高侃活捉车鼻可汗送到","0","2","2"
"侃活捉车鼻可汗送到朝","0","2","2"
"活捉车鼻可汗送到朝廷","0","2","2"
"将俘虏献到太庙和昭陵","0","2","2"
"英国公李责力坚决请求","0","2","2"
"国公李责力坚决请求解","0","2","2"
"公李责力坚决请求解除","0","2","2"
"李责力坚决请求解除职","0","2","2"
"责力坚决请求解除职务","0","2","2"
"令以开府仪同三司同中","0","2","2"
"以开府仪同三司同中书","0","2","2"
"三司同中书门下三品任","0","2","2"
"司同中书门下三品任用","0","2","2"
"河南郡公褚遂良降职为","0","2","2"
"南郡公褚遂良降职为同","0","2","2"
"郡公褚遂良降职为同州","0","2","2"
"公褚遂良降职为同州刺","0","2","2"
"褚遂良降职为同州刺史","0","2","2"
"沙钵罗叶护阿史那贺鲁","0","2","2"
"钵罗叶护阿史那贺鲁凭","0","2","2"
"罗叶护阿史那贺鲁凭借","0","2","2"
"叶护阿史那贺鲁凭借州","0","2","2"
"护阿史那贺鲁凭借州府","0","2","2"
"阿史那贺鲁凭借州府叛","0","2","2"
"史那贺鲁凭借州府叛乱","0","2","2"
"那些遭受虫灾水灾之处","0","2","2"
"些遭受虫灾水灾之处有","0","2","2"
"遭受虫灾水灾之处有贫","0","2","2"
"受虫灾水灾之处有贫乏","0","2","2"
"虫灾水灾之处有贫乏的","0","2","2"
"灾水灾之处有贫乏的人","0","2","2"
"各派郎中一人任使者去","0","2","2"
"派郎中一人任使者去慰","0","2","2"
"郎中一人任使者去慰问","0","2","2"
"以符朕眷顾思念百姓之","0","2","2"
"符朕眷顾思念百姓之心","0","2","2"
"试用中书侍郎柳为中书","0","2","2"
"用中书侍郎柳为中书侍","0","2","2"
"中书侍郎柳为中书侍郎","0","2","2"
"开府仪同三司及京官文","0","2","2"
"府仪同三司及京官文武","0","2","2"
"仪同三司及京官文武职","0","2","2"
"同三司及京官文武职事","0","2","2"
"三司及京官文武职事四","0","2","2"
"司及京官文武职事四品","0","2","2"
"卫大将军契艹必何力为","0","2","2"
"大将军契艹必何力为弓","0","2","2"
"将军契艹必何力为弓月","0","2","2"
"军契艹必何力为弓月道","0","2","2"
"契艹必何力为弓月道总","0","2","2"
"艹必何力为弓月道总管","0","2","2"
"必何力为弓月道总管而","0","2","2"
"何力为弓月道总管而讨","0","2","2"
"力为弓月道总管而讨伐","0","2","2"
"为弓月道总管而讨伐他","0","2","2"
"大食国开始派遣使者来","0","2","2"
"食国开始派遣使者来唐","0","2","2"
"国开始派遣使者来唐朝","0","2","2"
"开始派遣使者来唐朝拜","0","2","2"
"始派遣使者来唐朝拜贡","0","2","2"
"派遣使者来唐朝拜贡献","0","2","2"
"燕国公于志宁为尚书左","0","2","2"
"国公于志宁为尚书左仆","0","2","2"
"公于志宁为尚书左仆射","0","2","2"
"北平县公张行成为尚书","0","2","2"
"平县公张行成为尚书右","0","2","2"
"县公张行成为尚书右仆","0","2","2"
"公张行成为尚书右仆射","0","2","2"
"中书令兼检校吏部尚书","0","2","2"
"在高昌旧地设置安西都","0","2","2"
"高昌旧地设置安西都护","0","2","2"
"昌旧地设置安西都护府","0","2","2"
"命令左领将军赵孝祖讨","0","2","2"
"令左领将军赵孝祖讨平","0","2","2"
"左领将军赵孝祖讨平他","0","2","2"
"因为从去年秋天到这月","0","2","2"
